supermarket,category,name,price,reference_price,reference_unit,insert_date
dia-es,conservas_caldos_y_cremas,Yemas de espárrago medianas DESTAPA LA HUERTA   FRASCO 110 GR,2.35,21.36,kg,2023-07-10
dia-es,conservas_caldos_y_cremas,Habitas baby en aceite de oliva LEYENDA   FRASCO 140 GR,3.15,22.5,kg,2023-07-10
dia-es,conservas_caldos_y_cremas,Setas nameko VEGECAMPO  FRASCO 170 GR,1.89,11.12,kg,2023-07-10
dia-es,conservas_caldos_y_cremas,Alubias blancas bajo contenido en sal VEGECAMPO  FRASCO 400 GR,0.95,2.38,kg,2023-07-10
dia-es,conservas_caldos_y_cremas,Alubias blancas extra VEGECAMPO  FRASCO 210 GR,0.7,3.33,kg,2023-07-10
dia-es,conservas_caldos_y_cremas,Escalivada al horno de leña HIDA   FRASCO 330 GR,2.99,9.06,kg,2023-07-10
dia-es,conservas_caldos_y_cremas,Pimientos del piquillo rojos y verdes en tiras DESTAPA LA HUERTA   FRASCO 275 GR,1.89,6.87,kg,2023-07-10
dia-es,conservas_caldos_y_cremas,Pimientos del piquillo asado a la parrilla DESTAPA LA HUERTA   FRASCO 295 GR,2.5,8.47,kg,2023-07-10
dia-es,conservas_caldos_y_cremas,Corazones de alcachofas ecológica 4/8 piezas CYNARA   FRASCO 115 GR,2.99,26.0,kg,2023-07-10
dia-es,conservas_caldos_y_cremas,Corazones de alcachofas a la parrilla CYNARA   FRASCO 115 GR,2.35,20.43,kg,2023-07-10
dia-es,conservas_caldos_y_cremas,Cardo ecológico DANTZA   FRASCO 425 GR,2.59,6.09,kg,2023-07-10
dia-es,conservas_caldos_y_cremas,Pimiento de piquillo ecológico DANTZA   FRASCO 195 GR,4.59,23.54,kg,2023-07-10
dia-es,conservas_caldos_y_cremas,Pimientos de piquillo asados CIDACOS   FRASCO 400 GR,2.89,7.23,kg,2023-07-10
dia-es,conservas_caldos_y_cremas,Ensalada de garbanzos GVTARRA   FRASCO 345 GR,3.09,8.96,kg,2023-07-10
dia-es,conservas_caldos_y_cremas,Ensalada campesina GVTARRA   FRASCO 345 GR,3.09,8.96,kg,2023-07-10
dia-es,conservas_caldos_y_cremas,Ensalada rusa GVTARRA   FRASCO 345 GR,3.09,8.96,kg,2023-07-10
dia-es,conservas_caldos_y_cremas,Garbanzo de escacena cocido LUENGO   FRASCO 400 GR,1.5,3.75,kg,2023-07-10
dia-es,conservas_caldos_y_cremas,Lenteja pardina cocida LUENGO   FRASCO 400 GR,1.5,3.75,kg,2023-07-10
dia-es,conservas_caldos_y_cremas,Alubia de la bañeza cocida LUENGO   FRASCO 400 GR,1.5,3.75,kg,2023-07-10
dia-es,conservas_caldos_y_cremas,Patata entera YBARRA   FRASCO 400 GR,2.19,5.48,kg,2023-07-10
dia-es,conservas_caldos_y_cremas,Pimientos de piquillo dop de lodosa DELICIAS DE DIA  FRASCO 220 GR,3.39,15.41,kg,2023-07-10
dia-es,conservas_caldos_y_cremas,Ensalada de pimientos ALSUR   LATA 355 GR,2.29,6.45,kg,2023-07-10
dia-es,conservas_caldos_y_cremas,Setas nameko ALTA COCINA   FRASCO 0.17 ML,1.49,8764.71,l,2023-07-10
dia-es,conservas_caldos_y_cremas,Setas shiitake al natural ALTA COCINA   FRASCO 0.17 ML,1.49,8764.71,l,2023-07-10
dia-es,conservas_caldos_y_cremas,Garbanzo cocido ecológico LUENGO   FRASCO 400 GR,1.99,4.98,kg,2023-07-10
dia-es,conservas_caldos_y_cremas,Alubia blanca cocida ecológica LUENGO   FRASCO 400 GR,1.99,4.98,kg,2023-07-10
dia-es,conservas_caldos_y_cremas,Espárragos blancos igp de navarra DELICIAS DE DIA  FRASCO 205 GR,4.09,19.95,kg,2023-07-10
dia-es,conservas_caldos_y_cremas,Maíz dulce sin sal BONDUELLE  pack 2 unidades LATA 280 GR,2.69,9.61,kg,2023-07-10
dia-es,conservas_caldos_y_cremas,Zanahoria rallada BONDUELLE   FRASCO 110 GR,1.59,14.45,kg,2023-07-10
dia-es,conservas_caldos_y_cremas,Habas tiernas DIAMIR   FRASCO 425 GR,2.35,5.53,kg,2023-07-10
dia-es,conservas_caldos_y_cremas,Guisantes CIDACOS  pack 3 unidades LATA 360 GR,3.15,8.75,kg,2023-07-10
dia-es,conservas_caldos_y_cremas,Guisantes bio BONDUELLE  pack 2 unidades LATA 260 GR,3.25,12.5,kg,2023-07-10
dia-es,conservas_caldos_y_cremas,Guisantes medianos VEGECAMPO  LATA 265 GR,0.85,3.21,kg,2023-07-10
dia-es,conservas_caldos_y_cremas,Corazones de alcachofas VEGECAMPO  FRASCO 165 GR,1.95,11.82,kg,2023-07-10
dia-es,conservas_caldos_y_cremas,Tallo de espárrago blanco VEGECAMPO  LATA 250 GR,1.35,5.4,kg,2023-07-10
dia-es,conservas_caldos_y_cremas,Acelgas YBARRA   FRASCO 425 GR,1.75,4.12,kg,2023-07-10
dia-es,conservas_caldos_y_cremas,Alubias pintas cocidas VEGECAMPO  FRASCO 400 GR,1.1,2.75,kg,2023-07-10
dia-es,conservas_caldos_y_cremas,Mazorquitas de maíz RIOVERDE   BOTE 190 GR,2.49,13.11,kg,2023-07-10
dia-es,conservas_caldos_y_cremas,Espárragos blancos cortos gruesos CARRETILLA   FRASCO 110 GR,3.25,29.55,kg,2023-07-10
dia-es,conservas_caldos_y_cremas,Col troceada GVTARRA   FRASCO 400 GR,2.39,5.98,kg,2023-07-10
dia-es,conservas_caldos_y_cremas,Edamame BONDUELLE  pack 2 unidades LATA 160 GR,2.59,16.19,kg,2023-07-10
dia-es,conservas_caldos_y_cremas,Revuelto de setas BUJANDA   FRASCO 140 GR,1.99,14.21,kg,2023-07-10
dia-es,conservas_caldos_y_cremas,Pimientos del piquillo rojos y verdes BUJANDA   FRASCO 220 GR,1.99,9.05,kg,2023-07-10
dia-es,conservas_caldos_y_cremas,Guisantes tiernos y muy finos BONDUELLE   LATA 250 GR,2.19,8.76,kg,2023-07-10
dia-es,conservas_caldos_y_cremas,Judías verdes extra finas BONDUELLE   FRASCO 280 GR,3.99,14.25,kg,2023-07-10
dia-es,conservas_caldos_y_cremas,Maíz dulce BONDUELLE  pack 2 unidades LATA 280 GR,1.99,7.11,kg,2023-07-10
dia-es,conservas_caldos_y_cremas,Garbanzos cocidos bajo contenido en sal VEGECAMPO  FRASCO 400 GR,1.09,2.73,kg,2023-07-10
dia-es,conservas_caldos_y_cremas,Alubias rojas cocidas VEGECAMPO  FRASCO 400 GR,1.05,2.63,kg,2023-07-10
dia-es,conservas_caldos_y_cremas,Pimientos del piquillo enteros CARRETILLA   FRASCO 260 GR,2.99,11.5,kg,2023-07-10
dia-es,conservas_caldos_y_cremas,Pimientos rojos DIAMIR  pack 3 unidades LATA 180 GR,1.75,9.72,kg,2023-07-10
dia-es,conservas_caldos_y_cremas,Menestra de verduras YBARRA   FRASCO 400 GR,2.95,7.38,kg,2023-07-10
dia-es,conservas_caldos_y_cremas,Garbanzos con verduras cocidas LUENGO   FRASCO 400 GR,1.49,3.73,kg,2023-07-10
dia-es,conservas_caldos_y_cremas,Alubias con verduras cocidas LUENGO   FRASCO 400 GR,1.45,3.63,kg,2023-07-10
dia-es,conservas_caldos_y_cremas,Cebolla frita HIDA  pack 2 unidades LATA 310 GR,1.75,5.65,kg,2023-07-10
dia-es,conservas_caldos_y_cremas,Cardo troceado GVTARRA   FRASCO 400 GR,3.49,8.73,kg,2023-07-10
dia-es,conservas_caldos_y_cremas,Pimientos del piquillo enteros VEGECAMPO  LATA 150 GR,1.35,9.0,kg,2023-07-10
dia-es,conservas_caldos_y_cremas,Maíz ligero bajo sin sal GIGANTE VERDE  pack 2 unidades LATA 280 GR,2.99,10.68,kg,2023-07-10
dia-es,conservas_caldos_y_cremas,Judías verdes troceadas BONDUELLE   FRASCO 360 GR,3.19,8.86,kg,2023-07-10
dia-es,conservas_caldos_y_cremas,Espinacas YBARRA   FRASCO 425 GR,1.75,4.12,kg,2023-07-10
dia-es,conservas_caldos_y_cremas,Judía verde ecológica DANTZA   FRASCO 355 GR,2.45,6.9,kg,2023-07-10
dia-es,conservas_caldos_y_cremas,Maíz bio BONDUELLE  pack 2 unidades LATA 280 GR,3.1,11.07,kg,2023-07-10
dia-es,conservas_caldos_y_cremas,Garbanzos cocidos LEGUMBRES LA ASTURIANA   FRASCO 210 GR,1.25,5.95,kg,2023-07-10
dia-es,conservas_caldos_y_cremas,Garbanzo cocido sin sal LEGUMBRES LA ASTURIANA   FRASCO 400 GR,1.85,4.63,kg,2023-07-10
dia-es,conservas_caldos_y_cremas,Alubia cocido sin sal LEGUMBRES LA ASTURIANA   FRASCO 400 GR,1.85,4.63,kg,2023-07-10
dia-es,conservas_caldos_y_cremas,Yemas de espárragos muy gruesos VEGECAMPO  FRASCO 110 GR,1.99,18.09,kg,2023-07-10
dia-es,conservas_caldos_y_cremas,Judión cocido extra VEGECAMPO  FRASCO 400 GR,1.65,4.13,kg,2023-07-10
dia-es,conservas_caldos_y_cremas,Champiñones enteros VEGECAMPO  LATA 185 GR,1.29,6.97,kg,2023-07-10
dia-es,conservas_caldos_y_cremas,Maíz clásico GIGANTE VERDE  pack 2 unidades LATA 280 GR,2.79,9.96,kg,2023-07-10
dia-es,conservas_caldos_y_cremas,Remolacha en rodajas VEGECAMPO  FRASCO 180 GR,1.05,5.83,kg,2023-07-10
dia-es,conservas_caldos_y_cremas,Espárragos blancos extra IAN   LATA 150 GR,3.05,20.33,kg,2023-07-10
dia-es,conservas_caldos_y_cremas,Espárragos verdes delgados VEGECAMPO  FRASCO 100 GR,1.55,15.5,kg,2023-07-10
dia-es,conservas_caldos_y_cremas,Alubias pintas cocidas LEGUMBRES LA ASTURIANA   FRASCO 400 GR,1.8,4.5,kg,2023-07-10
dia-es,conservas_caldos_y_cremas,Alubia cocida LUENGO   FRASCO 400 GR,1.29,3.23,kg,2023-07-10
dia-es,conservas_caldos_y_cremas,Espárragos blancos extra muy gruesos 6/12 piezas CARRETILLA   FRASCO 325 GR,4.85,14.92,kg,2023-07-10
dia-es,conservas_caldos_y_cremas,Garbanzos cocidos LUENGO   FRASCO 400 GR,1.07,2.68,kg,2023-07-10
dia-es,conservas_caldos_y_cremas,Corazones de alcachofas VEGECAMPO  FRASCO 115 GR,1.75,15.22,kg,2023-07-10
dia-es,conservas_caldos_y_cremas,Magro de cerdo cocido COREN   LATA 220 GR,2.49,11.32,kg,2023-07-10
dia-es,conservas_caldos_y_cremas,Salchichas bockwurst SELECCION MUNDIAL  FRASCO 250 GR,2.69,10.76,kg,2023-07-10
dia-es,conservas_caldos_y_cremas,Salchicha alemana cocktail SELECCION MUNDIAL  FRASCO 150 GR,2.45,16.33,kg,2023-07-10
dia-es,conservas_caldos_y_cremas,Salchichas cocidas bockwurst MEICA   FRASCO 250 GR,4.99,19.96,kg,2023-07-10
dia-es,conservas_caldos_y_cremas,Caldo de pollo DIA DIA  CAJA 24 UD,1.25,0.05,ud,2023-07-10
dia-es,conservas_caldos_y_cremas,Pastillas de caldo de pollo GALLINA BLANCA AVECREM  CAJA 8 UD,1.35,0.17,ud,2023-07-10
dia-es,conservas_caldos_y_cremas,Pastillas de caldo de pollo GALLINA BLANCA AVECREM  CAJA 24 UD,3.05,0.13,ud,2023-07-10
dia-es,conservas_caldos_y_cremas,Caldo de carne GALLINA BLANCA AVECREM  CAJA 20 UD,1.99,0.1,ud,2023-07-10
dia-es,conservas_caldos_y_cremas,Caldo de carne KNORR   CAJA 18 UD,1.99,0.11,ud,2023-07-10
dia-es,conservas_caldos_y_cremas,Pastillas de caldo de pollo GALLINA BLANCA AVECREM  CAJA 8 UD,1.35,0.17,ud,2023-07-10
dia-es,conservas_caldos_y_cremas,Caldo desgrasado de carne   CAJA 12 UD,0.7,0.06,ud,2023-07-10
dia-es,conservas_caldos_y_cremas,Caldo de pescado KNORR   CAJA 12 UD,1.79,0.15,ud,2023-07-10
dia-es,conservas_caldos_y_cremas,Caldo desgrasado de verduras   CAJA 12 UD,0.7,0.06,ud,2023-07-10
dia-es,conservas_caldos_y_cremas,Caldo vegetal KNORR   CAJA 12 UD,1.79,0.15,ud,2023-07-10
dia-es,conservas_caldos_y_cremas,Hierbas provenzales MAGGI   SOBRE 34 GR,1.19,35.0,kg,2023-07-10
dia-es,conservas_caldos_y_cremas,Caldo de carne GALLINA BLANCA AVECREM  CAJA 20 UD,1.99,0.1,ud,2023-07-10
dia-es,conservas_caldos_y_cremas,Caldo de pollo casero DIA DIA  BRIK 1 LT,0.8,0.8,l,2023-07-10
dia-es,conservas_caldos_y_cremas,Caldo casero de pollo 100% natural GALLINA BLANCA   BRIK 1 LT,2.2,2.2,l,2023-07-10
dia-es,conservas_caldos_y_cremas,Caldo de cocido DIA DIA  BRIK 1 LT,0.95,0.95,l,2023-07-10
dia-es,conservas_caldos_y_cremas,Caldo de pollo bajo en sal 100% natural GALLINA BLANCA   BRIK 1 LT,2.2,2.2,l,2023-07-10
dia-es,conservas_caldos_y_cremas,Caldo casero de pollo 100% natural GALLINA BLANCA   BRIK 1 LT,2.2,2.2,l,2023-07-10
dia-es,conservas_caldos_y_cremas,Caldo casero de cocido 100% natural GALLINA BLANCA   BRIK 1 LT,2.2,2.2,l,2023-07-10
dia-es,conservas_caldos_y_cremas,Sopa de pollo con fideos DIA DIA  SOBRE 68 GR,0.5,7.35,kg,2023-07-10
dia-es,conservas_caldos_y_cremas,Caldo de pescado DIA DIA  BRIK 1 LT,1.15,1.15,l,2023-07-10
dia-es,conservas_caldos_y_cremas,Sopa de pollo con fideos GALLINA BLANCA   SOBRE 71 GR,0.85,11.97,kg,2023-07-10
dia-es,conservas_caldos_y_cremas,Sopa jardinera DIA DIA  SOBRE 75 GR,0.5,6.67,kg,2023-07-10
dia-es,conservas_caldos_y_cremas,Sopa de ternera con estrellitas GALLINA BLANCA   SOBRE 74 GR,0.85,11.49,kg,2023-07-10
dia-es,conservas_caldos_y_cremas,Caldo de pollo 100% natural GALLINA BLANCA  pack 2 unidades BRIK 2 LT,4.16,2.08,l,2023-07-10
dia-es,conservas_caldos_y_cremas,Caldo para paella de marisco CREMLUX   BRIK 1 LT,2.35,2.35,l,2023-07-10
dia-es,conservas_caldos_y_cremas,Sopa de cocido con fideos GALLINA BLANCA   SOBRE 72 GR,0.85,11.81,kg,2023-07-10
dia-es,conservas_caldos_y_cremas,Caldo de verduras CREMLUX   BRIK 1 LT,1.09,1.09,l,2023-07-10
dia-es,conservas_caldos_y_cremas,Crema de pollo con picatostes GALLINA BLANCA SOPINSTANT  CAJA 63 GR,1.45,23.02,kg,2023-07-10
dia-es,conservas_caldos_y_cremas,Sopa de pollo con maravilla GALLINA BLANCA   SOBRE 85 GR,0.85,10.0,kg,2023-07-10
dia-es,conservas_caldos_y_cremas,Caldo para paella de marisco GALLINA BLANCA   BRIK 1 LT,3.39,3.39,l,2023-07-10
dia-es,conservas_caldos_y_cremas,Sopa de ave con fideos GALLINA BLANCA   SOBRE 76 GR,0.85,11.18,kg,2023-07-10
dia-es,conservas_caldos_y_cremas,Fumet de pescado GALLINA BLANCA   BRIK 1 LT,3.39,3.39,l,2023-07-10
dia-es,conservas_caldos_y_cremas,Caldo gourmet de pollo GALLINA BLANCA   BRIK 1 LT,2.99,2.99,l,2023-07-10
dia-es,conservas_caldos_y_cremas,Caldo natural de verduras GALLO   BRIK 1 LT,2.99,2.99,l,2023-07-10
dia-es,conservas_caldos_y_cremas,Caldo natural de cocido GALLO  pack 2 unidades BRIK 1 LT,2.99,2.99,l,2023-07-10
dia-es,conservas_caldos_y_cremas,Caldo natural de pollo ANETO   BRIK 1 LT,2.95,2.95,l,2023-07-10
dia-es,conservas_caldos_y_cremas,Caldo natural de cocido madrileño ANETO   BRIK 1 LT,4.55,4.55,l,2023-07-10
dia-es,conservas_caldos_y_cremas,Caldo natural de cocido EL PAVO   BRIK 1 LT,3.75,3.75,l,2023-07-10
dia-es,conservas_caldos_y_cremas,Caldo natural de pollo de corral EL PAVO   BRIK 1 LT,3.75,3.75,l,2023-07-10
dia-es,conservas_caldos_y_cremas,Caldo casero de puchero GALLINA BLANCA   BRIK 1 LT,2.2,2.2,l,2023-07-10
dia-es,conservas_caldos_y_cremas,Caldo de cocido 100% natural GALLINA BLANCA  pack 2 unidades BRIK 2 LT,4.16,2.08,l,2023-07-10
dia-es,conservas_caldos_y_cremas,Caldo natural de verduras ANETO   BRIK 1 LT,3.99,3.99,l,2023-07-10
dia-es,conservas_caldos_y_cremas,Caldo casero de verduras GALLINA BLANCA   BRIK 1 LT,2.2,2.2,l,2023-07-10
dia-es,conservas_caldos_y_cremas,Crema de espárragos GALLINA BLANCA SOPINSTANT  CAJA 57 GR,1.45,25.44,kg,2023-07-10
dia-es,conservas_caldos_y_cremas,Sopa jardinera GALLINA BLANCA   SOBRE 77 GR,0.85,11.04,kg,2023-07-10
dia-es,conservas_caldos_y_cremas,Caldo de carne 100% natural GALLINA BLANCA   BRIK 1 LT,2.2,2.2,l,2023-07-10
dia-es,conservas_caldos_y_cremas,Caldo de pollo bajo en sal 100% natural GALLINA BLANCA   BRIK 1 LT,2.2,2.2,l,2023-07-10
dia-es,conservas_caldos_y_cremas,Caldo de pescado 100% natural GALLINA BLANCA   BRIK 1 LT,2.2,2.2,l,2023-07-10
dia-es,conservas_caldos_y_cremas,Sopa de verduras con picatostes GALLINA BLANCA SOPINSTANT  CAJA 51 GR,1.45,28.43,kg,2023-07-10
dia-es,conservas_caldos_y_cremas,Sopa de verduras GALLINA BLANCA   SOBRE 51 GR,0.85,16.67,kg,2023-07-10
dia-es,conservas_caldos_y_cremas,Caldo de pollo de corral 100% natural GALLINA BLANCA   BRIK 1 LT,2.99,2.99,l,2023-07-10
dia-es,conservas_caldos_y_cremas,Sopa de cebolla KNORR   SOBRE 54 GR,0.75,13.89,kg,2023-07-10
dia-es,conservas_caldos_y_cremas,Sopa de pollo con fideos finos bajo en sal GALLINA BLANCA   SOBRE 68 GR,0.85,12.5,kg,2023-07-10
dia-es,conservas_caldos_y_cremas,Caldo de pollo bajo en sal ANETO   BRIK 1 LT,3.95,3.95,l,2023-07-10
dia-es,conservas_caldos_y_cremas,Crema de calabaza AL PUNTO  BRIK 500 ML,1.25,2.5,l,2023-07-10
dia-es,conservas_caldos_y_cremas,Crema de verduras de la huerta KNORR   SOBRE 500 ML,2.39,4.78,l,2023-07-10
dia-es,conservas_caldos_y_cremas,Crema de verduras AL PUNTO  BRIK 500 ML,1.25,2.5,l,2023-07-10
dia-es,conservas_caldos_y_cremas,Crema de verduras mediterráneas KNORR   CAJA 500 ML,2.39,4.78,l,2023-07-10
dia-es,conservas_caldos_y_cremas,Crema de calabacín con queso AL PUNTO  BRIK 500 ML,1.25,2.5,l,2023-07-10
dia-es,conservas_caldos_y_cremas,Puré de patatas PATATAS UNIDAS  CAJA 500 GR,1.9,3.8,kg,2023-07-10
dia-es,conservas_caldos_y_cremas,Crema de calabaza KNORR   BRIK 500 ML,2.39,4.78,l,2023-07-10
dia-es,conservas_caldos_y_cremas,Puré de patatas MAGGI   CAJA 230 GR,2.29,9.96,kg,2023-07-10
dia-es,conservas_caldos_y_cremas,Crema casera de pollo con verduras GALLINA BLANCA   BRIK 500 ML,1.99,3.98,l,2023-07-10
dia-es,conservas_caldos_y_cremas,"Crema de zanahoria, calabaza y guisantes KNORR   BRIK 500 ML",2.39,4.78,l,2023-07-10
dia-es,conservas_caldos_y_cremas,Crema de verduras mediterráneas KNORR   CAJA 500 ML,2.39,4.78,l,2023-07-10
dia-es,conservas_caldos_y_cremas,Puré de patatas con leche MAGGI   CAJA 230 GR,2.29,9.96,kg,2023-07-10
dia-es,conservas_caldos_y_cremas,Crema de puerro y patata KNORR   SOBRE 500 ML,2.39,4.78,l,2023-07-10
dia-es,conservas_caldos_y_cremas,Crema de verduras de la huerta KNORR   SOBRE 500 ML,2.39,4.78,l,2023-07-10
dia-es,panes_harinas_y_masas,Barra de pan EL MOLINO DE DIA  BOLSA 250 GR,0.48,1.92,kg,2023-07-10
dia-es,panes_harinas_y_masas,Chapata de cristal 2 unidades   BOLSA 190 GR,1.81,9.53,kg,2023-07-10
dia-es,panes_harinas_y_masas,Barra de pan baguette EL MOLINO DE DIA  BOLSA 250 GR,0.54,2.16,kg,2023-07-10
dia-es,panes_harinas_y_masas,Barra de pan chapata EL MOLINO DE DIA  BOLSA 300 GR,0.65,2.17,kg,2023-07-10
dia-es,panes_harinas_y_masas,Barra de pan de picos EL MOLINO DE DIA   BOLSA 260 GR,0.68,2.62,kg,2023-07-10
dia-es,panes_harinas_y_masas,Barra de pan integral 100% EL MOLINO DE DIA  BOLSA 220 GR,0.65,2.95,kg,2023-07-10
dia-es,panes_harinas_y_masas,Mollete de antequera mediano HORNO EL ANTEQUERANO   BOLSA 280 GR,1.2,4.29,kg,2023-07-10
dia-es,panes_harinas_y_masas,Pan candeal grande EL MOLINO DE DIA  BOLSA 500 GR,1.43,2.86,kg,2023-07-10
dia-es,panes_harinas_y_masas,Barra de pan EL MOLINO DE DIA  BOLSA 125 GR,0.27,2.16,kg,2023-07-10
dia-es,panes_harinas_y_masas,Barra de pan 8 cereales EL MOLINO DE DIA  CAJA 210 GR,0.91,4.33,kg,2023-07-10
dia-es,panes_harinas_y_masas,Barra de pan picado andaluz EL MOLINO DE DIA  BOLSA 130 GR,0.39,3.0,kg,2023-07-10
dia-es,panes_harinas_y_masas,Barra de pan peregrina EL MOLINO DE DIA  BOLSA 250 GR,0.76,3.04,kg,2023-07-10
dia-es,panes_harinas_y_masas,Barra de pan baguette con semillas LA HORNADA DIA   BOLSA 250 GR,0.97,3.88,kg,2023-07-10
dia-es,panes_harinas_y_masas,Pan de horno de piedra EL MOLINO DE DIA  600 GR,1.43,2.38,kg,2023-07-10
dia-es,panes_harinas_y_masas,Hogaza rústica EL MOLINO DE DIA  BOLSA 350 GR,0.99,2.83,kg,2023-07-10
dia-es,panes_harinas_y_masas,Barra de pan panadera EL MOLINO DE DIA  275 GR,0.78,2.84,kg,2023-07-10
dia-es,panes_harinas_y_masas,Barra de pan espiga   300 GR,0.82,2.73,kg,2023-07-10
dia-es,panes_harinas_y_masas,Barra de pan para torrijas   BOLSA 300 GR,1.19,3.97,kg,2023-07-10
dia-es,panes_harinas_y_masas,Barra de pan parisienne EL MOLINO DE DIA  CAJA 300 GR,0.78,2.6,kg,2023-07-10
dia-es,panes_harinas_y_masas,Barra de pan sésamo y lino EL MOLINO DE DIA  CAJA 265 GR,1.1,4.15,kg,2023-07-10
dia-es,panes_harinas_y_masas,Barra de pan de horno de piedra EL MOLINO DE DIA  BOLSA 600 GR,1.34,2.23,kg,2023-07-10
dia-es,panes_harinas_y_masas,Pan de molde formato familiar EL MOLINO DE DIA  BOLSA 820 GR,1.25,1.52,kg,2023-07-10
dia-es,panes_harinas_y_masas,Pan de molde blanco sin corteza EL MOLINO DE DIA  BOLSA 450 GR,1.29,2.87,kg,2023-07-10
dia-es,panes_harinas_y_masas,Pan de molde 100% integral familiar EL MOLINO DE DIA  BOLSA 820 GR,1.25,1.52,kg,2023-07-10
dia-es,panes_harinas_y_masas,Pan de hamburguesa maxi EL MOLINO DE DIA  BOLSA 300 GR,0.9,3.0,kg,2023-07-10
dia-es,panes_harinas_y_masas,Panecillos para perritos EL MOLINO DE DIA  BOLSA 330 GR,1.0,3.03,kg,2023-07-10
dia-es,panes_harinas_y_masas,Pan de molde 100% integral sin corteza EL MOLINO DE DIA  BOLSA 450 GR,1.39,3.09,kg,2023-07-10
dia-es,panes_harinas_y_masas,Hogaza de centeno y avena EL MOLINO DE DIA  BOLSA 500 GR,2.19,4.38,kg,2023-07-10
dia-es,panes_harinas_y_masas,Pan de hamburguesa EL MOLINO DE DIA  BOLSA 220 GR,1.0,4.55,kg,2023-07-10
dia-es,panes_harinas_y_masas,Pan de molde blanco EL MOLINO DE DIA  BOLSA 460 GR,0.85,1.85,kg,2023-07-10
dia-es,panes_harinas_y_masas,Pan de molde 100% integral EL MOLINO DE DIA  BOLSA 460 GR,0.95,2.07,kg,2023-07-10
dia-es,panes_harinas_y_masas,Pan de molde integral 15 cereales y semillas EL MOLINO DE DIA  BOLSA 675 GR,1.48,2.19,kg,2023-07-10
dia-es,panes_harinas_y_masas,Hogaza de centeno EL MOLINO DE DIA  BOLSA 500 GR,2.19,4.38,kg,2023-07-10
dia-es,panes_harinas_y_masas,Pan de molde rústico EL MOLINO DE DIA  BOLSA 600 GR,1.85,3.08,kg,2023-07-10
dia-es,panes_harinas_y_masas,Pan de molde blanco grande BIMBO   BOLSA 375 GR,1.59,4.24,kg,2023-07-10
dia-es,panes_harinas_y_masas,Pan de molde blanco sin corteza BIMBO   BOLSA 450 GR,2.69,5.98,kg,2023-07-10
dia-es,panes_harinas_y_masas,Pan de molde especial tostadas EL MOLINO DE DIA  BOLSA 820 GR,1.89,2.3,kg,2023-07-10
dia-es,panes_harinas_y_masas,Pan de molde formato familiar BIMBO   BOLSA 700 GR,2.49,3.56,kg,2023-07-10
dia-es,panes_harinas_y_masas,Hogaza con pipas de calabaza EL MOLINO DE DIA  BOLSA 500 GR,2.19,4.38,kg,2023-07-10
dia-es,panes_harinas_y_masas,Pan de hamburguesas BIMBO   BOLSA 300 GR,2.45,8.17,kg,2023-07-10
dia-es,panes_harinas_y_masas,Pan sottile cereales y semillas 8 unidades DULCESOL   BOLSA 310 GR,1.69,5.45,kg,2023-07-10
dia-es,panes_harinas_y_masas,Maxi pan de hamburguesa BIMBO   BOLSA 320 GR,2.89,9.03,kg,2023-07-10
dia-es,panes_harinas_y_masas,Pan especial de trigo y centeno THE RUSTIK BAKERY   BOLSA 185 GR,1.95,10.54,kg,2023-07-10
dia-es,panes_harinas_y_masas,Pan especial de trigo THE RUSTIK BAKERY   BOLSA 185 GR,1.8,9.73,kg,2023-07-10
dia-es,panes_harinas_y_masas,Cruapán clásico BIMBO   BOLSA 380 GR,3.85,10.13,kg,2023-07-10
dia-es,panes_harinas_y_masas,Rapiditas clásicas minis BIMBO   BOLSA 168 GR,2.15,12.8,kg,2023-07-10
dia-es,panes_harinas_y_masas,Pan de molde complet sin gluten PROCELI   BOLSA 280 GR,2.99,10.68,kg,2023-07-10
dia-es,panes_harinas_y_masas,Pan de molde classic sin gluten PROCELI   BOLSA 280 GR,2.85,10.18,kg,2023-07-10
dia-es,panes_harinas_y_masas,Bagels con semillas BIMBO   BOLSA 300 GR,2.79,9.3,kg,2023-07-10
dia-es,panes_harinas_y_masas,Pan de molde artesano brioche BIMBO   BOLSA 550 GR,3.15,5.73,kg,2023-07-10
dia-es,panes_harinas_y_masas,Baguette rústica sin gluten PROCELI   BOLSA 120 GR,1.91,15.92,kg,2023-07-10
dia-es,panes_harinas_y_masas,Pan chapata rústico sin gluten PROCELI   BOLSA 120 GR,1.91,15.92,kg,2023-07-10
dia-es,panes_harinas_y_masas,Pan de molde natural 100% integral BIMBO   BOLSA 450 GR,3.15,7.0,kg,2023-07-10
dia-es,panes_harinas_y_masas,Pan de molde artesano BIMBO   BOLSA 550 GR,2.99,5.44,kg,2023-07-10
dia-es,panes_harinas_y_masas,Pan de molde con pipas OROWEAT   BOLSA 590 GR,3.25,5.51,kg,2023-07-10
dia-es,panes_harinas_y_masas,Pan de molde 50% blanco 50% integral BIMBO   BOLSA 460 GR,2.69,5.85,kg,2023-07-10
dia-es,panes_harinas_y_masas,Pan tradicional sin gluten PROCELI   BOLSA 160 GR,2.29,14.31,kg,2023-07-10
dia-es,panes_harinas_y_masas,Pan molde 12 cereales y semillas OROWEAT   BOLSA 590 GR,3.15,5.34,kg,2023-07-10
dia-es,panes_harinas_y_masas,Pan de pita precocido STAR   BOLSA 400 GR,2.29,5.73,kg,2023-07-10
dia-es,panes_harinas_y_masas,Palitos de pan con queso SNATT'S   BOLSA 56 GR,1.25,22.32,kg,2023-07-10
dia-es,panes_harinas_y_masas,Regañás con aceite de oliva virgen extra EL MOLINO DE DIA  BOLSA 150 GR,1.49,9.93,kg,2023-07-10
dia-es,panes_harinas_y_masas,Pan tostado normal EL MOLINO DE DIA  BOLSA 270 GR,0.99,3.67,kg,2023-07-10
dia-es,panes_harinas_y_masas,Pan tostado integral EL MOLINO DE DIA  BOLSA 270 GR,1.39,5.15,kg,2023-07-10
dia-es,panes_harinas_y_masas,Biscotes integrales EL MOLINO DE DIA  BOLSA 540 GR,1.95,3.61,kg,2023-07-10
dia-es,panes_harinas_y_masas,Picos camperos con aceite de oliva virgen extra EL MOLINO DE DIA  BOLSA 200 GR,1.45,7.25,kg,2023-07-10
dia-es,panes_harinas_y_masas,Surtido de picos y regañás HORNO EL ANTEQUERANO   BOLSA 150 GR,1.59,10.6,kg,2023-07-10
dia-es,panes_harinas_y_masas,Biscotes EL MOLINO DE DIA  BOLSA 540 GR,1.85,3.43,kg,2023-07-10
dia-es,panes_harinas_y_masas,Picos de pan EL MOLINO DE DIA  BOLSA 250 GR,0.85,3.4,kg,2023-07-10
dia-es,panes_harinas_y_masas,Palitos de pan con pipas NATURMUNDO  BOLSA 90 GR,0.85,9.44,kg,2023-07-10
dia-es,panes_harinas_y_masas,Picos integrales EL MOLINO DE DIA  BOLSA 250 GR,0.85,3.4,kg,2023-07-10
dia-es,panes_harinas_y_masas,Panecillos tostados con tomate y orégano EL MOLINO DE DIA  BOLSA 160 GR,1.25,7.81,kg,2023-07-10
dia-es,panes_harinas_y_masas,Picos rústicos con aceite de oliva EL MOLINO DE DIA  BOLSA 130 GR,1.69,13.0,kg,2023-07-10
dia-es,panes_harinas_y_masas,Picatostes fritos EL MOLINO DE DIA  BOLSA 75 GR,0.69,9.2,kg,2023-07-10
dia-es,panes_harinas_y_masas,Panecillos tostados con ajo y perejil EL MOLINO DE DIA  BOLSA 160 GR,1.25,7.81,kg,2023-07-10
dia-es,panes_harinas_y_masas,Picos reventaos EL MOLINO DE DIA  BOLSA 250 GR,0.99,3.96,kg,2023-07-10
dia-es,panes_harinas_y_masas,Panecillo 100% integral EL MOLINO DE DIA  BOLSA 225 GR,0.89,3.96,kg,2023-07-10
dia-es,panes_harinas_y_masas,Mini tostas DIA DIA  CAJA 100 GR,1.39,13.9,kg,2023-07-10
dia-es,panes_harinas_y_masas,Rosquillas de pan EL MOLINO DE DIA  BOLSA 250 GR,1.0,4.0,kg,2023-07-10
dia-es,panes_harinas_y_masas,Regañás PRODUCTOS DOMINGUEZ   BOLSA 250 GR,1.05,4.2,kg,2023-07-10
dia-es,panes_harinas_y_masas,Bocaditos de tomate y orégano SNATT'S   BOLSA 110 GR,1.55,14.09,kg,2023-07-10
dia-es,panes_harinas_y_masas,Bocaditos sabor jamón y tomate SNATT'S   BOLSA 110 GR,1.55,14.09,kg,2023-07-10
dia-es,panes_harinas_y_masas,Pan tostado original WASA   PAQUETE 205 GR,2.49,12.15,kg,2023-07-10
dia-es,panes_harinas_y_masas,Pan chapata rústica RECONDO   CAJA 180 GR,2.55,14.17,kg,2023-07-10
dia-es,panes_harinas_y_masas,Mini biscotes EL MOLINO DE DIA  BOLSA 240 GR,1.59,6.63,kg,2023-07-10
dia-es,panes_harinas_y_masas,Pan tostado integral bajo en sal y azúcar EL MOLINO DE DIA  BOLSA 324 GR,1.65,5.09,kg,2023-07-10
dia-es,panes_harinas_y_masas,Palitos de pan con queso NATURMUNDO  BOLSA 90 GR,0.85,9.44,kg,2023-07-10
dia-es,panes_harinas_y_masas,Panecillos tostados EL MOLINO DE DIA  BOLSA 225 GR,0.85,3.78,kg,2023-07-10
dia-es,panes_harinas_y_masas,Pan tostado con sésamo WASA   PAQUETE 200 GR,2.79,13.95,kg,2023-07-10
dia-es,panes_harinas_y_masas,Picos de Antequera EL MOLINO DE DIA  BOLSA 150 GR,1.89,12.6,kg,2023-07-10
dia-es,panes_harinas_y_masas,Piquitos bajo contenido en sal EL MOLINO DE DIA  BOLSA 180 GR,1.09,6.06,kg,2023-07-10
dia-es,panes_harinas_y_masas,Picatostes con aceite de oliva sin gluten ESGIR   BOLSA 70 GR,1.0,14.29,kg,2023-07-10
dia-es,panes_harinas_y_masas,Colines sin gluten PROCELI   BOLSA 150 GR,2.55,17.0,kg,2023-07-10
dia-es,panes_harinas_y_masas,Pan tostado tradicional ORTIZ   BOLSA 324 GR,2.79,8.61,kg,2023-07-10
