supermarket,category,name,price,reference_price,reference_unit,insert_date
dia-es,patatas_fritas_encurtidos_y_frutos_secos,Aperitivo de maíz horneado CHEETOS   BOLSA 96 GR,1.89,19.69,kg,2023-07-10
dia-es,patatas_fritas_encurtidos_y_frutos_secos,Patatas fritas SANTA ANA   BOLSA 270 GR,3.19,11.81,kg,2023-07-10
dia-es,patatas_fritas_encurtidos_y_frutos_secos,Torreznos LA MADRILEÑA   BOTE 125 GR,2.79,22.32,kg,2023-07-10
dia-es,patatas_fritas_encurtidos_y_frutos_secos,Palomitas sabor ketchup y mostaza RISI   BOLSA 105 GR,1.59,15.14,kg,2023-07-10
dia-es,patatas_fritas_encurtidos_y_frutos_secos,Palomitas RISI   BOLSA 105 GR,1.59,15.14,kg,2023-07-10
dia-es,patatas_fritas_encurtidos_y_frutos_secos,Pringles cheesy cheese PRINGLES   BOTE 165 GR,2.49,15.09,kg,2023-07-10
dia-es,patatas_fritas_encurtidos_y_frutos_secos,Surtido de snacks picoteo TOSFRIT   BOLSA 80 GR,0.99,12.38,kg,2023-07-10
dia-es,patatas_fritas_encurtidos_y_frutos_secos,Snacks de patata pombear GREFUSA   BOLSA 80 GR,1.69,21.13,kg,2023-07-10
dia-es,patatas_fritas_encurtidos_y_frutos_secos,Palomitas de colores FRIT RAVICH   BOLSA 130 GR,1.65,12.69,kg,2023-07-10
dia-es,patatas_fritas_encurtidos_y_frutos_secos,Cocktail de snacks JUMPERS   BOLSA 100 GR,1.25,12.5,kg,2023-07-10
dia-es,patatas_fritas_encurtidos_y_frutos_secos,Patatas fritas picantes PRINGLES   BOTE 165 GR,2.49,15.09,kg,2023-07-10
dia-es,patatas_fritas_encurtidos_y_frutos_secos,Torreznos SNACK MANIAC  BOLSA 100 GR,1.35,13.5,kg,2023-07-10
dia-es,patatas_fritas_encurtidos_y_frutos_secos,Cortezas de cerdo SNACK MANIAC  BOLSA 75 GR,0.89,11.87,kg,2023-07-10
dia-es,patatas_fritas_encurtidos_y_frutos_secos,Patatas paja SNACK MANIAC  BOLSA 200 GR,1.69,8.45,kg,2023-07-10
dia-es,patatas_fritas_encurtidos_y_frutos_secos,Palomitas de maíz con sal SNACK MANIAC  BOLSA 80 GR,1.15,14.38,kg,2023-07-10
dia-es,patatas_fritas_encurtidos_y_frutos_secos,Nachos sabor a jalapeño SNACK MANIAC  BOLSA 150 GR,1.39,9.27,kg,2023-07-10
dia-es,patatas_fritas_encurtidos_y_frutos_secos,Patatas fritas a la vinagreta SNACK MANIAC  BOLSA 130 GR,1.55,11.92,kg,2023-07-10
dia-es,patatas_fritas_encurtidos_y_frutos_secos,Aperitivo frito con sabor a jamón GREFUSA   BOLSA 73 GR,1.69,23.15,kg,2023-07-10
dia-es,patatas_fritas_encurtidos_y_frutos_secos,Aperitivo frito con sabor a barbacoa GREFUSA   BOLSA 135 GR,1.69,12.52,kg,2023-07-10
dia-es,patatas_fritas_encurtidos_y_frutos_secos,Aperitivo horneado ASPIL   BOLSA 36 GR,1.25,34.72,kg,2023-07-10
dia-es,patatas_fritas_encurtidos_y_frutos_secos,Patatas fritas sabor pizza PRINGLES   BOTE 165 GR,2.49,15.09,kg,2023-07-10
dia-es,patatas_fritas_encurtidos_y_frutos_secos,Patatas fritas gourmet corte fino LAY'S   BOLSA 150 GR,2.99,19.93,kg,2023-07-10
dia-es,patatas_fritas_encurtidos_y_frutos_secos,Bolitas de queso SNACK MANIAC  BOLSA 85 GR,0.99,11.65,kg,2023-07-10
dia-es,patatas_fritas_encurtidos_y_frutos_secos,Patatas fritas sabor huevo frito SNACK MANIAC  BOLSA 130 GR,1.49,11.46,kg,2023-07-10
dia-es,patatas_fritas_encurtidos_y_frutos_secos,Patatas fritas paprika PRINGLES   BOTE 70 GR,1.4,20.0,kg,2023-07-10
dia-es,patatas_fritas_encurtidos_y_frutos_secos,Patatas fritas sabor crema y cebolla PRINGLES   BOTE 70 GR,1.4,20.0,kg,2023-07-10
dia-es,patatas_fritas_encurtidos_y_frutos_secos,Patatas fritas original PRINGLES   BOTE 70 GR,1.4,20.0,kg,2023-07-10
dia-es,patatas_fritas_encurtidos_y_frutos_secos,Conos de maíz sabor a queso y bacon LAY'S 3 D'S  BOLSA 100 GR,1.99,19.9,kg,2023-07-10
dia-es,patatas_fritas_encurtidos_y_frutos_secos,Snack de multicereales con sal marina SUNBITES   BOLSA 95 GR,2.19,23.05,kg,2023-07-10
dia-es,patatas_fritas_encurtidos_y_frutos_secos,Aperitivo de maíz frito DORITOS   BOLSA 150 GR,2.29,15.27,kg,2023-07-10
dia-es,patatas_fritas_encurtidos_y_frutos_secos,Aperitivo frito con sabor a queso CHEETOS   BOLSA 25 GR,0.65,26.0,kg,2023-07-10
dia-es,patatas_fritas_encurtidos_y_frutos_secos,Gusanitos RISI   BOLSA 105 GR,1.69,16.1,kg,2023-07-10
dia-es,patatas_fritas_encurtidos_y_frutos_secos,Aperitivo de maíz frito con sabor a barbacoa DORITOS   BOLSA 48 GR,0.65,1.35,,2023-07-10
dia-es,patatas_fritas_encurtidos_y_frutos_secos,Aperitivo de maíz con sabor a mantequilla JUMPERS   BOLSA 100 GR,1.25,12.5,kg,2023-07-10
dia-es,patatas_fritas_encurtidos_y_frutos_secos,Triskys RISI   BOLSA 135 GR,1.59,11.78,kg,2023-07-10
dia-es,patatas_fritas_encurtidos_y_frutos_secos,Patatas fritas sabor crema y cebolla PRINGLES   BOTE 165 GR,2.49,15.09,kg,2023-07-10
dia-es,patatas_fritas_encurtidos_y_frutos_secos,Patatas fritas sabor campesina LAY'S   BOLSA 250 GR,3.09,12.36,kg,2023-07-10
dia-es,patatas_fritas_encurtidos_y_frutos_secos,Patatas fritas sabor campesina LAY'S   BOLSA 150 GR,1.99,13.27,kg,2023-07-10
dia-es,patatas_fritas_encurtidos_y_frutos_secos,Patatas fritas sabor vinagreta LAY'S   BOLSA 150 GR,1.99,13.27,kg,2023-07-10
dia-es,patatas_fritas_encurtidos_y_frutos_secos,Palitos de patata SNACK MANIAC  BOLSA 100 GR,1.29,12.9,kg,2023-07-10
dia-es,patatas_fritas_encurtidos_y_frutos_secos,Patatas fritas sabor jamón PRINGLES   BOTE 165 GR,2.49,15.09,kg,2023-07-10
dia-es,patatas_fritas_encurtidos_y_frutos_secos,Aros de maíz frito TOSFRIT   BOLSA 120 GR,1.09,9.08,kg,2023-07-10
dia-es,patatas_fritas_encurtidos_y_frutos_secos,Aperitivo de maíz horneado CHEETOS   BOLSA 30 GR,0.65,2.17,,2023-07-10
dia-es,patatas_fritas_encurtidos_y_frutos_secos,"Aperitivo de maíz frito con sabor a pimiento picante
nachos sabor picante DORITOS   BOLSA 140 GR",1.99,14.21,kg,2023-07-10
dia-es,patatas_fritas_encurtidos_y_frutos_secos,Patatas fritas al punto de sal LAY'S   BOLSA 265 GR,2.99,11.28,kg,2023-07-10
dia-es,patatas_fritas_encurtidos_y_frutos_secos,Aperitivo de maíz horneado con sabor a queso CHEETOS   BOLSA 36 GR,0.65,18.06,kg,2023-07-10
dia-es,patatas_fritas_encurtidos_y_frutos_secos,Aperitivo frito sabor barbacoa FRITOS   BOLSA 54 GR,0.65,12.04,kg,2023-07-10
dia-es,patatas_fritas_encurtidos_y_frutos_secos,Nachos sabor a queso DORITOS   BOLSA 40 GR,0.75,18.75,kg,2023-07-10
dia-es,patatas_fritas_encurtidos_y_frutos_secos,Conos de maíz con sabor a queso y bacon LAY'S 3 D'S  BOLSA 33 GR,0.65,19.7,kg,2023-07-10
dia-es,patatas_fritas_encurtidos_y_frutos_secos,Patatas fritas paprika PRINGLES   BOTE 165 GR,2.49,15.09,kg,2023-07-10
dia-es,patatas_fritas_encurtidos_y_frutos_secos,Apetinas sabor ketchup TOSFRIT   BOLSA 90 GR,1.29,14.33,kg,2023-07-10
dia-es,patatas_fritas_encurtidos_y_frutos_secos,Palomitas sabor ketchup y mostaza RISI   BOLSA 90 GR,1.39,15.44,kg,2023-07-10
dia-es,patatas_fritas_encurtidos_y_frutos_secos,Patatas fritas al punto de sal LAY'S   BOLSA 160 GR,1.99,12.44,kg,2023-07-10
dia-es,patatas_fritas_encurtidos_y_frutos_secos,Cortezas de trigo sabor a carne LAY'S BOCABITS  BOLSA 84 GR,1.99,23.69,kg,2023-07-10
dia-es,patatas_fritas_encurtidos_y_frutos_secos,Aperitivo frito sabor barbacoa FRITOS   BOLSA 146 GR,1.99,13.63,kg,2023-07-10
dia-es,patatas_fritas_encurtidos_y_frutos_secos,Aperitivo frito con sabor a queso CHEETOS   BOLSA 75 GR,1.89,25.2,kg,2023-07-10
dia-es,patatas_fritas_encurtidos_y_frutos_secos,Patatas fritas onduladas RUFFLES   BOLSA 160 GR,1.99,12.44,kg,2023-07-10
dia-es,patatas_fritas_encurtidos_y_frutos_secos,Patatas fritas onduladas sabor a jamón RUFFLES   BOLSA 150 GR,1.99,13.27,kg,2023-07-10
dia-es,patatas_fritas_encurtidos_y_frutos_secos,Nachos sabor a queso DORITOS   BOLSA 140 GR,1.99,14.21,kg,2023-07-10
dia-es,patatas_fritas_encurtidos_y_frutos_secos,Nachips OLD EL PASO   BOLSA 200 GR,2.89,14.45,kg,2023-07-10
dia-es,patatas_fritas_encurtidos_y_frutos_secos,Patatas fritas al horno LAY'S   BOLSA 150 GR,2.49,16.6,kg,2023-07-10
dia-es,patatas_fritas_encurtidos_y_frutos_secos,Aperitivo horneado con sabor a queso y ketchup CHEETOS   BOLSA 96 GR,1.89,19.69,kg,2023-07-10
dia-es,patatas_fritas_encurtidos_y_frutos_secos,Aceitunas negras sin hueso VEGECAMPO  LATA 150 GR,1.0,6.67,kg,2023-07-10
dia-es,patatas_fritas_encurtidos_y_frutos_secos,Aceitunas rellenas de anchoa suave VEGECAMPO  LATA 150 GR,0.99,6.6,kg,2023-07-10
dia-es,patatas_fritas_encurtidos_y_frutos_secos,Aceitunas rellenas de anchoa VEGECAMPO pack 3 unidades LATA 150 GR,1.49,9.93,kg,2023-07-10
dia-es,patatas_fritas_encurtidos_y_frutos_secos,Pepinillos agridulces VEGECAMPO  FRASCO 360 GR,1.95,5.42,kg,2023-07-10
dia-es,patatas_fritas_encurtidos_y_frutos_secos,Aceitunas verdes sin hueso VEGECAMPO  FRASCO 400 GR,2.15,5.38,kg,2023-07-10
dia-es,patatas_fritas_encurtidos_y_frutos_secos,Aceitunas rellenas de anchoa VEGECAMPO pack 3 unidades LATA 450 GR,2.65,5.89,kg,2023-07-10
dia-es,patatas_fritas_encurtidos_y_frutos_secos,Cebollitas y pepinillos VEGECAMPO  FRASCO 380 GR,1.79,4.71,kg,2023-07-10
dia-es,patatas_fritas_encurtidos_y_frutos_secos,Pepinillos pequeños VEGECAMPO  FRASCO 180 GR,1.15,6.39,kg,2023-07-10
dia-es,patatas_fritas_encurtidos_y_frutos_secos,Pepinillos sabor anchoa VEGECAMPO  FRASCO 180 GR,1.29,7.17,kg,2023-07-10
dia-es,patatas_fritas_encurtidos_y_frutos_secos,Aceitunas verdes sin hueso VEGECAMPO pack 3 unidades BOLSA 225 GR,1.6,7.11,kg,2023-07-10
dia-es,patatas_fritas_encurtidos_y_frutos_secos,Aceitunas chupadedos con hueso VEGECAMPO  FRASCO 410 GR,2.45,5.98,kg,2023-07-10
dia-es,patatas_fritas_encurtidos_y_frutos_secos,Banderillas picantes VEGECAMPO  FRASCO 140 GR,1.49,10.64,kg,2023-07-10
dia-es,patatas_fritas_encurtidos_y_frutos_secos,Banderillas dulces VEGECAMPO  FRASCO 140 GR,1.45,10.36,kg,2023-07-10
dia-es,patatas_fritas_encurtidos_y_frutos_secos,Aceitunas gordal aliñada sin hueso VEGECAMPO  FRASCO 340 GR,2.95,8.68,kg,2023-07-10
dia-es,patatas_fritas_encurtidos_y_frutos_secos,Aceitunas verdes con hueso VEGECAMPO  FRASCO 500 GR,2.15,4.3,kg,2023-07-10
dia-es,patatas_fritas_encurtidos_y_frutos_secos,Cebollitas en vinagre VEGECAMPO  FRASCO 180 GR,1.29,7.17,kg,2023-07-10
dia-es,patatas_fritas_encurtidos_y_frutos_secos,Guindillas en vinagre VEGECAMPO  FRASCO 120 GR,1.29,10.75,kg,2023-07-10
dia-es,patatas_fritas_encurtidos_y_frutos_secos,Aceitunas gazpacha VEGECAMPO  FRASCO 410 GR,2.19,5.34,kg,2023-07-10
dia-es,patatas_fritas_encurtidos_y_frutos_secos,Aceitunas rellenas de anchoa del cantábrico JOLCA   LATA 150 GR,2.25,15.0,kg,2023-07-10
dia-es,patatas_fritas_encurtidos_y_frutos_secos,Pepinillo sabor anchoa RIOVERDE   FRASCO 180 GR,1.68,9.33,kg,2023-07-10
dia-es,patatas_fritas_encurtidos_y_frutos_secos,Aceituna negra sin hueso LA ESPAÑOLA   LATA 130 GR,1.99,15.31,kg,2023-07-10
dia-es,patatas_fritas_encurtidos_y_frutos_secos,Picadillo de variantes VEGECAMPO  FRASCO 200 GR,1.15,5.75,kg,2023-07-10
dia-es,patatas_fritas_encurtidos_y_frutos_secos,Cocktail de encurtidos SERPIS   LATA 150 GR,2.25,15.0,kg,2023-07-10
dia-es,patatas_fritas_encurtidos_y_frutos_secos,Aceitunas suaves rellenas de anchoa LA ESPAÑOLA   LATA 130 GR,2.05,15.77,kg,2023-07-10
dia-es,patatas_fritas_encurtidos_y_frutos_secos,Aceitunas rellenas de boquerón marinas LA ESPAÑOLA   LATA 130 GR,1.75,13.46,kg,2023-07-10
dia-es,patatas_fritas_encurtidos_y_frutos_secos,Aceitunas negras sin hueso SERPIS   LATA 130 GR,1.99,15.31,kg,2023-07-10
dia-es,patatas_fritas_encurtidos_y_frutos_secos,Aceituna manzanilla en rodajas JOLCA   BOLSA 120 GR,1.85,15.42,kg,2023-07-10
dia-es,patatas_fritas_encurtidos_y_frutos_secos,Pepinillo laminado RIOVERDE   BOTE 290 GR,2.45,8.45,kg,2023-07-10
dia-es,patatas_fritas_encurtidos_y_frutos_secos,Aceitunas con hueso aliño del abuelo FRAGATA   FRASCO 250 GR,2.59,10.36,kg,2023-07-10
dia-es,patatas_fritas_encurtidos_y_frutos_secos,Aceitunas con hueso aliño sevillano FRAGATA   FRASCO 250 GR,2.59,10.36,kg,2023-07-10
dia-es,patatas_fritas_encurtidos_y_frutos_secos,Aceituna aliñada receta del cortijo SARASA   LATA 185 GR,1.79,9.68,kg,2023-07-10
dia-es,patatas_fritas_encurtidos_y_frutos_secos,Aceitunas receta andaluza SARASA   TARRINA 200 GR,1.69,8.45,kg,2023-07-10
dia-es,patatas_fritas_encurtidos_y_frutos_secos,Aceitunas hechizos del sur SARASA   LATA 185 GR,1.89,10.22,kg,2023-07-10
dia-es,patatas_fritas_encurtidos_y_frutos_secos,Aceitunas negras sin hueso JOLCA   BOLSA 75 GR,1.05,14.0,kg,2023-07-10
dia-es,patatas_fritas_encurtidos_y_frutos_secos,Aceitunas rellenas de anchoa SERPIS   LATA 130 GR,2.05,15.77,kg,2023-07-10
dia-es,patatas_fritas_encurtidos_y_frutos_secos,Aceitunas rellenas de anchoa EL FARO   LATA 150 GR,1.99,13.27,kg,2023-07-10
dia-es,patatas_fritas_encurtidos_y_frutos_secos,Aceitunas verdes en rodajas VEGECAMPO pack 3 unidades LATA 150 GR,1.79,11.93,kg,2023-07-10
dia-es,patatas_fritas_encurtidos_y_frutos_secos,Cocktail de aceitunas VEGECAMPO  FRASCO 400 GR,2.35,5.88,kg,2023-07-10
dia-es,patatas_fritas_encurtidos_y_frutos_secos,Aceitunas aliñadas VEGECAMPO  FRASCO 410 GR,2.19,5.34,kg,2023-07-10
dia-es,patatas_fritas_encurtidos_y_frutos_secos,Aceitunas rellenas de anchoa suave VEGECAMPO pack 3 unidades LATA 150 GR,1.75,11.67,kg,2023-07-10
dia-es,patatas_fritas_encurtidos_y_frutos_secos,Aceitunas rellenas de limón VEGECAMPO  LATA 150 GR,1.59,10.6,kg,2023-07-10
dia-es,patatas_fritas_encurtidos_y_frutos_secos,Aceitunas pelotin VEGECAMPO  FRASCO 250 GR,1.39,5.56,kg,2023-07-10
dia-es,patatas_fritas_encurtidos_y_frutos_secos,Aceitunas rellenas de anchoa sin potenciador VEGECAMPO  LATA 150 GR,1.55,10.33,kg,2023-07-10
dia-es,patatas_fritas_encurtidos_y_frutos_secos,Aceitunas rellenas de jalapeño VEGECAMPO  LATA 150 GR,1.65,11.0,kg,2023-07-10
dia-es,patatas_fritas_encurtidos_y_frutos_secos,Aceitunas negras con hueso VEGECAMPO  LATA 185 GR,1.15,6.22,kg,2023-07-10
dia-es,patatas_fritas_encurtidos_y_frutos_secos,Aceitunas rellenas de anchoa VEGECAMPO  LATA 345 GR,2.55,7.39,kg,2023-07-10
dia-es,patatas_fritas_encurtidos_y_frutos_secos,Aceitunas rellenas de anchoa SERPIS  pack 3 unidades LATA 120 GR,3.49,29.08,kg,2023-07-10
dia-es,patatas_fritas_encurtidos_y_frutos_secos,Cocktail de encurtidos RIOVERDE   FRASCO 180 GR,1.55,8.61,kg,2023-07-10
dia-es,patatas_fritas_encurtidos_y_frutos_secos,Aceitunas partidas aliñadas JOLCA   LATA 350 GR,1.95,5.57,kg,2023-07-10
dia-es,patatas_fritas_encurtidos_y_frutos_secos,Aceitunas negras sin hueso SERPIS   LATA 85 GR,1.59,18.71,kg,2023-07-10
dia-es,patatas_fritas_encurtidos_y_frutos_secos,Aceitunas rellenas de pimiento VEGECAMPO  LATA 150 GR,1.55,10.33,kg,2023-07-10
dia-es,patatas_fritas_encurtidos_y_frutos_secos,Aceitunas verdes sin hueso JOLCA   BOLSA 90 GR,0.89,9.89,kg,2023-07-10
dia-es,patatas_fritas_encurtidos_y_frutos_secos,Aceitunas verdes con hueso JOLCA   BOLSA 120 GR,0.89,7.42,kg,2023-07-10
dia-es,patatas_fritas_encurtidos_y_frutos_secos,Aceitunas rellenas de anchoa LA EXPLANADA   LATA 150 GR,1.99,13.27,kg,2023-07-10
dia-es,patatas_fritas_encurtidos_y_frutos_secos,Aceitunas gazpacha JOLCA   FRASCO 500 GR,4.05,8.1,kg,2023-07-10
dia-es,patatas_fritas_encurtidos_y_frutos_secos,Alcaparras en vinagre VEGECAMPO  FRASCO 80 GR,1.35,16.88,kg,2023-07-10
dia-es,patatas_fritas_encurtidos_y_frutos_secos,Aceitunas rellenas de anchoa 35% menos sal SERPIS  pack 3 unidades LATA 200 GR,3.35,16.75,kg,2023-07-10
dia-es,patatas_fritas_encurtidos_y_frutos_secos,Aceitunas rellenas de anchoa LA ESPAÑOLA   LATA 150 GR,2.19,14.6,kg,2023-07-10
dia-es,patatas_fritas_encurtidos_y_frutos_secos,Aceitunas rellenas de anchoa JOLCA   LATA 130 GR,1.75,13.46,kg,2023-07-10
dia-es,patatas_fritas_encurtidos_y_frutos_secos,Aceitunas rellenas de anchoa suave JOLCA   LATA 130 GR,1.85,14.23,kg,2023-07-10
dia-es,patatas_fritas_encurtidos_y_frutos_secos,Aceitunas manzanilla rellena de anchoa FRAGATA   LATA 150 GR,1.99,13.27,kg,2023-07-10
dia-es,patatas_fritas_encurtidos_y_frutos_secos,Aceitunas verdes con hueso sabor anchoa VEGECAMPO  FRASCO 500 GR,2.99,5.98,kg,2023-07-10
dia-es,patatas_fritas_encurtidos_y_frutos_secos,Aceitunas rellenas de anchoas SERPIS   LATA 130 GR,1.99,15.31,kg,2023-07-10
dia-es,patatas_fritas_encurtidos_y_frutos_secos,Aceitunas rellenas de anchoa bajo en sal SERPIS   LATA 130 GR,1.99,15.31,kg,2023-07-10
dia-es,patatas_fritas_encurtidos_y_frutos_secos,Nueces sin cáscara al natural NATURMUNDO  BOLSA 200 GR,2.49,12.45,kg,2023-07-10
dia-es,patatas_fritas_encurtidos_y_frutos_secos,Anacardo al natural NATURMUNDO  BOLSA 200 GR,2.49,12.45,kg,2023-07-10
dia-es,patatas_fritas_encurtidos_y_frutos_secos,Pistachos tostados sin sal NATURMUNDO  BOLSA 250 GR,3.49,13.96,kg,2023-07-10
dia-es,patatas_fritas_encurtidos_y_frutos_secos,Pistachos tostados con sal NATURMUNDO  BOLSA 250 GR,3.45,13.8,kg,2023-07-10
dia-es,patatas_fritas_encurtidos_y_frutos_secos,Almendras al natural con piel NATURMUNDO  BOLSA 200 GR,2.39,11.95,kg,2023-07-10
dia-es,patatas_fritas_encurtidos_y_frutos_secos,Avellanas tostadas NATURMUNDO  BOLSA 200 GR,2.95,14.75,kg,2023-07-10
dia-es,patatas_fritas_encurtidos_y_frutos_secos,Palomitas con sal SNACK MANIAC  CAJA 270 GR,1.25,4.63,kg,2023-07-10
dia-es,patatas_fritas_encurtidos_y_frutos_secos,Cacahuete frito salado NATURMUNDO  BOLSA 250 GR,1.0,4.0,kg,2023-07-10
dia-es,patatas_fritas_encurtidos_y_frutos_secos,Pipas gigantes aguasal SNACK MANIAC  BOLSA 200 GR,1.29,6.45,kg,2023-07-10
dia-es,patatas_fritas_encurtidos_y_frutos_secos,Almendras fritas saladas NATURMUNDO  BOLSA 200 GR,2.85,14.25,kg,2023-07-10
dia-es,patatas_fritas_encurtidos_y_frutos_secos,Mix frutos secos FRIT RAVICH   BOLSA 300 GR,2.9,9.67,kg,2023-07-10
dia-es,patatas_fritas_encurtidos_y_frutos_secos,Pipas gigantes con sal SNACK MANIAC  BOLSA 200 GR,1.29,6.45,kg,2023-07-10
dia-es,patatas_fritas_encurtidos_y_frutos_secos,Cacahuetes fritos con miel SNACK MANIAC  BOLSA 200 GR,1.69,8.45,kg,2023-07-10
dia-es,patatas_fritas_encurtidos_y_frutos_secos,Anacardos fritos NATURMUNDO  BOLSA 200 GR,2.3,11.5,kg,2023-07-10
dia-es,patatas_fritas_encurtidos_y_frutos_secos,Almendras al natural sin piel NATURMUNDO  BOLSA 125 GR,2.3,18.4,kg,2023-07-10
dia-es,patatas_fritas_encurtidos_y_frutos_secos,Cacahuete con cáscara sin sal NATURMUNDO  BOLSA 400 GR,1.7,4.25,kg,2023-07-10
dia-es,patatas_fritas_encurtidos_y_frutos_secos,Cocktail con miel y mostaza FRIT RAVICH   BOLSA 360 GR,2.89,8.03,kg,2023-07-10
dia-es,patatas_fritas_encurtidos_y_frutos_secos,Frutos secos clasic SNACK MANIAC  BOLSA 250 GR,1.85,7.4,kg,2023-07-10
dia-es,patatas_fritas_encurtidos_y_frutos_secos,Pipas g con sal GREFUSA   BOLSA 165 GR,1.79,10.85,kg,2023-07-10
dia-es,patatas_fritas_encurtidos_y_frutos_secos,Nuez pelada BORGES   BOLSA 130 GR,2.88,22.15,kg,2023-07-10
dia-es,patatas_fritas_encurtidos_y_frutos_secos,Palomitas al punto de sal microondas POPITAS   CAJA 300 GR,2.45,8.17,kg,2023-07-10
dia-es,patatas_fritas_encurtidos_y_frutos_secos,Pipas g tijuana GREFUSA   BOLSA 165 GR,1.79,10.85,kg,2023-07-10
dia-es,patatas_fritas_encurtidos_y_frutos_secos,Maíz para palomitas SNACK MANIAC  BOLSA 500 GR,1.59,3.18,kg,2023-07-10
dia-es,patatas_fritas_encurtidos_y_frutos_secos,Pipas supremas FACUNDO   BOLSA 120 GR,2.39,19.92,kg,2023-07-10
dia-es,patatas_fritas_encurtidos_y_frutos_secos,Nueces peladas GANCEDO   BOLSA 400 GR,3.99,9.98,kg,2023-07-10
dia-es,patatas_fritas_encurtidos_y_frutos_secos,Pipas aguasal GREFUSA PIPONAZO  BOLSA 195 GR,2.69,13.79,kg,2023-07-10
dia-es,patatas_fritas_encurtidos_y_frutos_secos,Pistachos tostados FRIT RAVICH   BOLSA 130 GR,2.99,23.0,kg,2023-07-10
dia-es,patatas_fritas_encurtidos_y_frutos_secos,Nuez pecana dia naturmundo NATURMUNDO  BOLSA 150 GR,3.59,23.93,kg,2023-07-10
dia-es,patatas_fritas_encurtidos_y_frutos_secos,Avellanas al natural NATURMUNDO  BOLSA 150 GR,2.25,15.0,kg,2023-07-10
dia-es,patatas_fritas_encurtidos_y_frutos_secos,Maíz frito sabor barbacoa SNACK MANIAC  BOLSA 170 GR,1.0,5.88,kg,2023-07-10
dia-es,patatas_fritas_encurtidos_y_frutos_secos,Pan de higo con almendras NATURMUNDO  BOLSA 200 GR,2.19,10.95,kg,2023-07-10
dia-es,patatas_fritas_encurtidos_y_frutos_secos,Pan de dátil con nueces NATURMUNDO  BOLSA 200 GR,2.19,10.95,kg,2023-07-10
dia-es,patatas_fritas_encurtidos_y_frutos_secos,Almendras con chocolate negro NATURMUNDO  BOLSA 170 GR,1.99,11.71,kg,2023-07-10
dia-es,patatas_fritas_encurtidos_y_frutos_secos,Nuez con chocolate con leche NATURMUNDO  BOLSA 170 GR,1.99,11.71,kg,2023-07-10
dia-es,patatas_fritas_encurtidos_y_frutos_secos,Frutos secos y pasas SNACK MANIAC  BOLSA 250 GR,1.85,7.4,kg,2023-07-10
dia-es,patatas_fritas_encurtidos_y_frutos_secos,Frutos secos tex SNACK MANIAC  BOLSA 200 GR,1.85,9.25,kg,2023-07-10
dia-es,patatas_fritas_encurtidos_y_frutos_secos,Pipas gigantes sin sal SNACK MANIAC  BOLSA 125 GR,0.99,7.92,kg,2023-07-10
dia-es,patatas_fritas_encurtidos_y_frutos_secos,Maíz frito barbacoa MISTER CORN   BOLSA 160 GR,1.99,12.44,kg,2023-07-10
dia-es,patatas_fritas_encurtidos_y_frutos_secos,Cócktail frutos de secos mix MISTER CORN   BOLSA 160 GR,1.99,12.44,kg,2023-07-10
dia-es,patatas_fritas_encurtidos_y_frutos_secos,Mix frutos secos naturales NATURMUNDO  BANDEJA 200 GR,3.0,15.0,kg,2023-07-10
dia-es,patatas_fritas_encurtidos_y_frutos_secos,Almendras tostadas con piel sin sal NATURMUNDO  BOLSA 200 GR,2.99,14.95,kg,2023-07-10
dia-es,patatas_fritas_encurtidos_y_frutos_secos,Almendras marcona frita NATURMUNDO  BOLSA 150 GR,3.49,23.27,kg,2023-07-10
dia-es,patatas_fritas_encurtidos_y_frutos_secos,Nuez de macadamia tostada con sal NATURMUNDO  BOLSA 100 GR,2.99,29.9,kg,2023-07-10
dia-es,patatas_fritas_encurtidos_y_frutos_secos,Nuez premium   MALLA 300 GR,1.99,6.63,kg,2023-07-10
dia-es,patatas_fritas_encurtidos_y_frutos_secos,Pipas GREFUSA PIPONAZO  BOLSA 195 GR,2.69,13.79,kg,2023-07-10
dia-es,patatas_fritas_encurtidos_y_frutos_secos,Nueces con cáscara al natural NATURMUNDO  BOLSA 500 GR,3.22,6.44,kg,2023-07-10
dia-es,patatas_fritas_encurtidos_y_frutos_secos,Pipas GREFUSA PIPONAZO  BOLSA 119 GR,1.89,15.88,kg,2023-07-10
dia-es,patatas_fritas_encurtidos_y_frutos_secos,Almendras fritas saladas BORGES   BOLSA 160 GR,2.99,18.69,kg,2023-07-10
dia-es,patatas_fritas_encurtidos_y_frutos_secos,Pipas de calabaza peladas FRIT RAVICH   BOLSA 115 GR,1.82,15.83,kg,2023-07-10
dia-es,patatas_fritas_encurtidos_y_frutos_secos,Pipas sabor tex mex SNACK MANIAC  BOLSA 200 GR,1.39,6.95,kg,2023-07-10
dia-es,patatas_fritas_encurtidos_y_frutos_secos,Cacahuetes con cáscara salados NATURMUNDO  BOLSA 400 GR,1.75,4.38,kg,2023-07-10
dia-es,patatas_fritas_encurtidos_y_frutos_secos,Cocktail picante FRIT RAVICH   BOLSA 360 GR,2.89,8.03,kg,2023-07-10
dia-es,patatas_fritas_encurtidos_y_frutos_secos,Almendras con piel tostadas NATURMUNDO  BOLSA 200 GR,2.89,14.45,kg,2023-07-10
dia-es,patatas_fritas_encurtidos_y_frutos_secos,Palomitas dulces SNACK MANIAC  CAJA 270 GR,1.75,6.48,kg,2023-07-10
dia-es,patatas_fritas_encurtidos_y_frutos_secos,Pipas blanquillas FACUNDO   BOLSA 140 GR,2.39,17.07,kg,2023-07-10
dia-es,patatas_fritas_encurtidos_y_frutos_secos,Cocktail frutos secos top FRIT RAVICH   BOLSA 170 GR,2.55,15.0,kg,2023-07-10
dia-es,patatas_fritas_encurtidos_y_frutos_secos,Palomitas pop up EAGLE  pack 2 unidades CAJA 200 GR,1.99,9.95,kg,2023-07-10
dia-es,patatas_fritas_encurtidos_y_frutos_secos,Piñones al natural NATURMUNDO  BOLSA 70 GR,18.0,257.14,kg,2023-07-10
dia-es,patatas_fritas_encurtidos_y_frutos_secos,Maíz tostado gigante SNACK MANIAC  BOLSA 200 GR,1.0,5.0,kg,2023-07-10
dia-es,patatas_fritas_encurtidos_y_frutos_secos,Cocktail frutos secos SNACK MANIAC  BOLSA 500 GR,2.59,5.18,kg,2023-07-10
dia-es,patatas_fritas_encurtidos_y_frutos_secos,Cacahuete frito con miel y sal EAGLE   BOLSA 90 GR,1.99,22.11,kg,2023-07-10
dia-es,pizzas_y_platos_preparados,Pizza jamón y queso AL PUNTO  BANDEJA 400 GR,2.49,6.23,kg,2023-07-10
dia-es,pizzas_y_platos_preparados,Pizza barbacoa AL PUNTO  BANDEJA 425 GR,2.49,5.86,kg,2023-07-10
dia-es,pizzas_y_platos_preparados,Pizza 4 quesos AL PUNTO  BANDEJA 390 GR,2.69,6.9,kg,2023-07-10
dia-es,pizzas_y_platos_preparados,Pizza carbonara AL PUNTO  BANDEJA 400 GR,2.75,6.88,kg,2023-07-10
dia-es,pizzas_y_platos_preparados,Pizza pollo AL PUNTO  BANDEJA 400 GR,2.75,6.88,kg,2023-07-10
dia-es,pizzas_y_platos_preparados,Pizza atún y bacon AL PUNTO  BANDEJA 400 GR,2.69,6.73,kg,2023-07-10
dia-es,pizzas_y_platos_preparados,Pizza serrana AL PUNTO  BANDEJA 390 GR,2.75,7.05,kg,2023-07-10
dia-es,pizzas_y_platos_preparados,Pizza jamón y queso CASA TARRADELLAS  pack 2 unidades BANDEJA 450 GR,3.19,7.09,kg,2023-07-10
dia-es,pizzas_y_platos_preparados,Pizza 4 quesos familiar AL PUNTO  BANDEJA 580 GR,3.97,6.84,kg,2023-07-10
dia-es,pizzas_y_platos_preparados,Pizza 4 quesos CASA TARRADELLAS   BANDEJA 390 GR,3.19,8.18,kg,2023-07-10
dia-es,pizzas_y_platos_preparados,Pizza jamón y queso CASA TARRADELLAS   BANDEJA 405 GR,3.19,7.88,kg,2023-07-10
dia-es,pizzas_y_platos_preparados,Pizza jamón y queso familiar AL PUNTO  BANDEJA 600 GR,3.97,6.62,kg,2023-07-10
dia-es,pizzas_y_platos_preparados,Pizza atún y bacon CASA TARRADELLAS   BANDEJA 405 GR,3.19,7.88,kg,2023-07-10
dia-es,pizzas_y_platos_preparados,Pizza carbonara CASA TARRADELLAS   BANDEJA 400 GR,3.19,7.98,kg,2023-07-10
dia-es,pizzas_y_platos_preparados,Pizza pollo CASA TARRADELLAS   BANDEJA 410 GR,3.19,7.78,kg,2023-07-10
dia-es,pizzas_y_platos_preparados,Pizza jamón serrano CASA TARRADELLAS   BANDEJA 390 GR,3.19,8.18,kg,2023-07-10
dia-es,pizzas_y_platos_preparados,Tortilla de patatas con cebolla AL PUNTO  BANDEJA 600 GR,2.59,4.32,kg,2023-07-10
dia-es,pizzas_y_platos_preparados,Fabada asturiana AL PUNTO  LATA 435 GR,1.6,3.68,kg,2023-07-10
dia-es,pizzas_y_platos_preparados,Fabada asturiana LITORAL   LATA 420 GR,2.5,5.95,kg,2023-07-10
dia-es,pizzas_y_platos_preparados,Flautas de pollo y 2 quesos LA BROCHE   BANDEJA 275 GR,2.45,8.91,kg,2023-07-10
dia-es,pizzas_y_platos_preparados,Hummus clásico AL PUNTO  TARRINA 220 GR,1.15,5.23,kg,2023-07-10
dia-es,pizzas_y_platos_preparados,Lasaña boloñesa AL PUNTO  BANDEJA 350 GR,2.67,7.63,kg,2023-07-10
dia-es,pizzas_y_platos_preparados,Tortilla de patatas sin cebolla AL PUNTO  BANDEJA 600 GR,2.59,4.32,kg,2023-07-10
dia-es,pizzas_y_platos_preparados,Noodles sabor pollo DIA DIA  SOBRE 85 GR,0.95,11.18,kg,2023-07-10
dia-es,pizzas_y_platos_preparados,Gyozas de pollo y verduras al teppanyaki AL PUNTO  BANDEJA 140 GR,2.99,21.36,kg,2023-07-10
dia-es,pizzas_y_platos_preparados,Tagliatelle carbonara DIA DIA  SOBRE 145 GR,1.25,8.62,kg,2023-07-10
