supermarket,category,name,price,reference_price,reference_unit,insert_date
dia-es,limpieza_y_hogar,Bayeta especial posavajillas SPONTEX   BOLSA 1 UD,4.19,4.19,ud,2023-07-10
dia-es,limpieza_y_hogar,Bolsa de basura con autocierre azul 30 lt SUPER PACO  30 UD,1.59,0.05,ud,2023-07-10
dia-es,limpieza_y_hogar,Bolsa de basura con autocierre 50 lt SUPER PACO  15 UD,1.85,0.12,ud,2023-07-10
dia-es,limpieza_y_hogar,Bolsa de basura con autocierre perfumada 30 lt SUPER PACO  20 UD,1.85,0.09,ud,2023-07-10
dia-es,limpieza_y_hogar,Bolsa de basura con autocierre amarilla 30 lt SUPER PACO  30 UD,1.85,0.06,ud,2023-07-10
dia-es,limpieza_y_hogar,Bolsas de basura autocierre perfumadas 10 lt SUPER PACO  30 UD,1.32,0.04,ud,2023-07-10
dia-es,limpieza_y_hogar,Bolsa de basura con autocierre comunidad 120 lt SUPER PACO  10 UD,2.89,0.29,ud,2023-07-10
dia-es,limpieza_y_hogar,Bolsa de basura compostable con autocierre 10 lt SUPER PACO  15 UD,2.15,0.14,ud,2023-07-10
dia-es,limpieza_y_hogar,Bolsa de basura comunidad 120 lt SUPER PACO  BOLSA 10 UD,1.59,0.16,ud,2023-07-10
dia-es,limpieza_y_hogar,Bolsa de basura para comunidad 120 lt ADVANCED   10 UD,1.65,0.17,ud,2023-07-10
dia-es,limpieza_y_hogar,Lejía con detergente DIA  GARRAFA 2 LT,1.19,0.6,l,2023-07-10
dia-es,limpieza_y_hogar,Lejía DIA  GARRAFA 5 LT,1.69,0.34,l,2023-07-10
dia-es,limpieza_y_hogar,Lejía con detergente CLOROMAX   GARRAFA 2 LT,1.75,0.88,l,2023-07-10
dia-es,limpieza_y_hogar,Lejía con detergente limón DIA  GARRAFA 2 LT,1.19,0.6,l,2023-07-10
dia-es,limpieza_y_hogar,Amoniaco perfumado DIA  BOTELLA 1.5 LT,0.69,0.46,l,2023-07-10
dia-es,limpieza_y_hogar,Lejía hogar garrafa amarilla DIA  GARRAFA 2 LT,0.85,0.43,l,2023-07-10
dia-es,limpieza_y_hogar,Lejía densa hogar DIA  GARRAFA 2 LT,1.17,0.59,l,2023-07-10
dia-es,limpieza_y_hogar,Lejía con detergente limón ESTRELLA   BOTELLA 1.43 LT,2.65,1.85,l,2023-07-10
dia-es,limpieza_y_hogar,Amoniaco con detergente DIA  BOTELLA 1.5 LT,0.99,0.66,l,2023-07-10
dia-es,limpieza_y_hogar,Lejía con detergente azul ESTRELLA   BOTELLA 1.43 LT,2.65,1.85,l,2023-07-10
dia-es,limpieza_y_hogar,Agua fuerte DIA  BOTELLA 1 LT,0.99,0.99,l,2023-07-10
dia-es,limpieza_y_hogar,Blanqueador BLANCO NUCLEAR   120 GR,2.89,24.08,kg,2023-07-10
dia-es,limpieza_y_hogar,Quitamanchas oxy color NEUTREX   BOTELLA 950 ML,3.99,4.2,l,2023-07-10
dia-es,limpieza_y_hogar,Lejía todo uso CLOROMAX   GARRAFA 5 LT,2.19,0.44,l,2023-07-10
dia-es,limpieza_y_hogar,Aditivo desinfectante textil SANYTOL   BOTELLA 500 ML,3.19,6.38,l,2023-07-10
dia-es,limpieza_y_hogar,Quitamanchas experto en seco CEBRALIN   SPRAY 200 ML,3.99,19.95,l,2023-07-10
dia-es,limpieza_y_hogar,Quitamanchas oxy blanco puro NEUTREX   BOTELLA 950 ML,3.99,4.2,l,2023-07-10
dia-es,limpieza_y_hogar,Quitamanchas VANISH   SPRAY 750 ML,4.99,6.65,l,2023-07-10
dia-es,limpieza_y_hogar,Aditivo desinfectante textil LYSOL   BOTELLA 720 ML,2.99,4.15,l,2023-07-10
dia-es,limpieza_y_hogar,Quitamanchas VANISH   BOTELLA 900 ML,5.99,6.66,l,2023-07-10
dia-es,limpieza_y_hogar,Quitamanchas desinfectante SANYTOL   BOTE 450 GR,5.29,11.76,kg,2023-07-10
dia-es,limpieza_y_hogar,Quitamanchas para ropa blanca VANISH   BOTE 450 GR,5.59,12.42,kg,2023-07-10
dia-es,limpieza_y_hogar,Quitamanchas para ropa de color VANISH   BOTE 450 GR,5.59,12.42,kg,2023-07-10
dia-es,limpieza_y_hogar,Friegasuelos aroma spa SUPER PACO  BOTELLA 1.5 LT,1.09,0.73,l,2023-07-10
dia-es,limpieza_y_hogar,Friegasuelos aroma pino SUPER PACO  BOTELLA 1.5 LT,1.09,0.73,l,2023-07-10
dia-es,limpieza_y_hogar,Limpiacristales SUPER PACO  SPRAY 1 LT,1.25,1.25,l,2023-07-10
dia-es,limpieza_y_hogar,Friegasuelos aroma colonia SUPER PACO  BOTELLA 1.5 LT,1.09,0.73,l,2023-07-10
dia-es,limpieza_y_hogar,Friegasuelos concentrado rosa SUPER PACO  BOTELLA 1 LT,1.85,1.85,l,2023-07-10
dia-es,limpieza_y_hogar,Friegasuelos aroma limón SUPER PACO  BOTELLA 1.5 LT,1.09,0.73,l,2023-07-10
dia-es,limpieza_y_hogar,Limpiacristales cristalino CRISTASOL   SPRAY 750 ML,2.69,3.59,l,2023-07-10
dia-es,limpieza_y_hogar,Limpiador madera DON LIMPIO   BOTELLA 1.3 LT,4.29,3.3,l,2023-07-10
dia-es,limpieza_y_hogar,Fregasuelos multi desinfección SANICENTRO   BOTELLA 1.5 LT,2.29,1.53,l,2023-07-10
dia-es,limpieza_y_hogar,Fregasuelos concentrado aroma naranja ASEVI   BOTELLA 900 ML,2.49,2.77,l,2023-07-10
dia-es,limpieza_y_hogar,Toallitas limpiagafas SUPER PACO  CAJA 30 UD,1.75,0.06,ud,2023-07-10
dia-es,limpieza_y_hogar,Limpiador multiusos DON LIMPIO   BOTELLA 1.3 LT,4.29,3.3,l,2023-07-10
dia-es,limpieza_y_hogar,Limpiacristales para ventanas ECOCLEOX   BOTELLA 500 ML,4.19,8.38,l,2023-07-10
dia-es,limpieza_y_hogar,Cera para suelos y madera TENSO PRO   BOTELLA 1 LT,3.69,3.69,l,2023-07-10
dia-es,limpieza_y_hogar,Limpiador de superficies universal ECOCLEOX   BOTELLA 500 ML,4.19,8.38,l,2023-07-10
dia-es,limpieza_y_hogar,Limpiador jabonoso de madera PRONTO   BOTELLA 750 ML,4.99,6.65,l,2023-07-10
dia-es,limpieza_y_hogar,Limpiador con bioalcohol aloe vera TENN   BOTELLA 1.3 LT,3.25,2.5,l,2023-07-10
dia-es,limpieza_y_hogar,Limpiador potente quitagrasa SUPER PACO  SPRAY 750 ML,1.75,2.33,l,2023-07-10
dia-es,limpieza_y_hogar,Quitagrasas cítrico SUPER PACO  SPRAY 750 ML,1.75,2.33,l,2023-07-10
dia-es,limpieza_y_hogar,Limpiador multiusos SUPER PACO  SPRAY 1 LT,1.39,1.39,l,2023-07-10
dia-es,limpieza_y_hogar,Limpiador gel baño SUPER PACO  BOTELLA 1.5 LT,1.59,1.06,l,2023-07-10
dia-es,limpieza_y_hogar,Vinagre de limpieza RIOJAVINA   BOTELLA 1 LT,1.15,1.15,l,2023-07-10
dia-es,limpieza_y_hogar,Limpiador desinfectante multiusos SANYTOL   SPRAY 750 ML,2.99,3.99,l,2023-07-10
dia-es,limpieza_y_hogar,Limpiamuebles HECHICERA   SPRAY 400 ML,3.19,7.98,l,2023-07-10
dia-es,limpieza_y_hogar,Limpiahogar ph neutro SUPER PACO  BOTELLA 1.5 LT,1.59,1.06,l,2023-07-10
dia-es,limpieza_y_hogar,Limpiador de baño acción total SUPER PACO  SPRAY 750 ML,1.85,2.47,l,2023-07-10
dia-es,limpieza_y_hogar,Toallitas limpiadoras multiusos SUPER PACO  BOLSA 80 UD,2.05,0.03,ud,2023-07-10
dia-es,limpieza_y_hogar,Limpiador oxígeno activo SUPER PACO  BOTELLA 1 LT,1.5,1.5,l,2023-07-10
dia-es,limpieza_y_hogar,Limpiahogar pino con bioalcohol SUPER PACO  BOTELLA 1.5 LT,1.8,1.2,l,2023-07-10
dia-es,limpieza_y_hogar,Limpiador de baño SUPER PACO  SPRAY 750 ML,1.69,2.25,l,2023-07-10
dia-es,limpieza_y_hogar,Limpiamuebles cuidado experto madera classic PRONTO   SPRAY 250 ML,2.99,11.96,l,2023-07-10
dia-es,limpieza_y_hogar,Limpiador desinfectante limpiahogar SANYTOL   BOTELLA 1.2 LT,3.29,2.74,l,2023-07-10
dia-es,limpieza_y_hogar,Limpiador antical SUPER PACO  SPRAY 750 ML,1.75,2.33,l,2023-07-10
dia-es,limpieza_y_hogar,Quitagrasas desinfectante ASEVI   SPRAY 720 ML,3.45,4.79,l,2023-07-10
dia-es,limpieza_y_hogar,Desinfectante multiusos gerpostar plus ASEVI   BOTELLA 750 ML,2.49,3.32,l,2023-07-10
dia-es,limpieza_y_hogar,Alcohol de limpieza perfumado SUPER PACO  SPRAY 300 ML,1.69,5.63,l,2023-07-10
dia-es,limpieza_y_hogar,Limpiador antical VIAKAL   SPRAY 700 ML,4.45,6.36,l,2023-07-10
dia-es,limpieza_y_hogar,Limpiador antical VIAKAL   BOTELLA 750 ML,4.45,5.93,l,2023-07-10
dia-es,limpieza_y_hogar,Limpiador de baño ultra brillo y limpieza CILLIT BANG   SPRAY 750 ML,4.59,6.12,l,2023-07-10
dia-es,limpieza_y_hogar,Limpiador baño DON LIMPIO   BOTELLA 1.3 LT,4.29,3.3,l,2023-07-10
dia-es,limpieza_y_hogar,Limpiahogar universal con bioalcohol TENN   BOTELLA 1.3 LT,3.25,2.5,l,2023-07-10
dia-es,limpieza_y_hogar,Limpiador multiusos GLASSEX   SPRAY 750 ML,2.99,3.99,l,2023-07-10
dia-es,limpieza_y_hogar,Limpiador desinfectante cocina frescor limón LYSOL   SPRAY 750 ML,3.29,4.39,l,2023-07-10
dia-es,limpieza_y_hogar,Limpiador de baño desinfectante sin lejía antical LYSOL   SPRAY 750 ML,3.29,4.39,l,2023-07-10
dia-es,limpieza_y_hogar,Desinfectante multiusos frescor manzana LYSOL   SPRAY 750 ML,3.29,4.39,l,2023-07-10
dia-es,limpieza_y_hogar,Recambios limpiadores ECOCLEOX   BOLSA 20 ML,3.09,154.5,l,2023-07-10
dia-es,limpieza_y_hogar,Recambios limpiadores ECOCLEOX   BOLSA 20 ML,3.09,154.5,l,2023-07-10
dia-es,limpieza_y_hogar,Recambios limpiadores ECOCLEOX   BOLSA 20 ML,3.09,154.5,l,2023-07-10
dia-es,limpieza_y_hogar,Recambios limpiadores ECOCLEOX   BOLSA 20 ML,3.09,154.5,l,2023-07-10
dia-es,limpieza_y_hogar,Limpiador cocina/baño ECOCLEOX   BOTELLA 500 ML,4.19,8.38,l,2023-07-10
dia-es,limpieza_y_hogar,Limpiador cocina/baño ECOCLEOX   BOTELLA 500 ML,4.19,8.38,l,2023-07-10
dia-es,limpieza_y_hogar,Toallitas multiusos DON LIMPIO   BOLSA 24 UD,2.19,0.09,ud,2023-07-10
dia-es,limpieza_y_hogar,Limpiador quitagrasas express DON LIMPIO   SPRAY 720 ML,3.99,5.54,l,2023-07-10
dia-es,limpieza_y_hogar,Limpiador baño DON LIMPIO   SPRAY 720 ML,3.99,5.54,l,2023-07-10
dia-es,limpieza_y_hogar,Limpiador multiusos SANICENTRO   SPRAY 750 ML,2.39,3.19,l,2023-07-10
dia-es,limpieza_y_hogar,Limpiador suciedad humedad CILLIT BANG   SPRAY 750 ML,5.39,7.19,l,2023-07-10
dia-es,limpieza_y_hogar,Limpiador desinfectante cocinas SANYTOL   SPRAY 750 ML,3.29,4.39,l,2023-07-10
dia-es,limpieza_y_hogar,Limpiador multi desinfectante SANICENTRO   BOTELLA 2 LT,2.69,1.35,l,2023-07-10
dia-es,limpieza_y_hogar,Limpiador de baño anti moho PATTEX   SPRAY 500 ML,6.49,12.98,l,2023-07-10
dia-es,limpieza_y_hogar,Limpiador pino AJAX   BOTELLA 1.25 LT,2.79,2.23,l,2023-07-10
dia-es,limpieza_y_hogar,Limpiador desinfectante baños SANYTOL   SPRAY 750 ML,3.29,4.39,l,2023-07-10
dia-es,limpieza_y_hogar,Limpiador multiusos aroma lavanda AJAX   BOTELLA 1.25 LT,2.79,2.23,l,2023-07-10
dia-es,limpieza_y_hogar,Toallitas desinfectantes SANYTOL   BOLSA 30 UD,2.39,0.08,ud,2023-07-10
dia-es,limpieza_y_hogar,Limpiador multiusos CILLIT BANG   SPRAY 1 LT,3.88,3.88,l,2023-07-10
dia-es,limpieza_y_hogar,Limpiador de baño con bioalcohol TENN   BOTELLA 1.3 LT,3.25,2.5,l,2023-07-10
dia-es,limpieza_y_hogar,Limpiador multiusos CRISTASOL   SPRAY 750 ML,2.55,3.4,l,2023-07-10
dia-es,limpieza_y_hogar,Limpia multisuperficies PRONTO   SPRAY 300 ML,3.29,0.01,,2023-07-10
dia-es,limpieza_y_hogar,Limpiador multiusos básico aroma limón DON LIMPIO   BOTELLA 1.3 LT,4.29,3.3,l,2023-07-10
dia-es,limpieza_y_hogar,Gel limpiador wc lejía perfumada SUPER PACO  BOTELLA 1 LT,1.15,1.15,l,2023-07-10
dia-es,limpieza_y_hogar,Gel limpiador wc azul marino SUPER PACO  BOTELLA 1 LT,1.19,1.19,l,2023-07-10
dia-es,limpieza_y_hogar,Gel limpiador wc pino SUPER PACO  BOTELLA 1 LT,1.19,1.19,l,2023-07-10
dia-es,limpieza_y_hogar,Colgador para wc floral SUPER PACO  BLISTER 96 GR,1.75,18.23,kg,2023-07-10
dia-es,limpieza_y_hogar,Colgador para wc agua azul SUPER PACO  BLISTER 96 GR,1.75,18.23,kg,2023-07-10
dia-es,limpieza_y_hogar,Colgador para wc limón SUPER PACO  BLISTER 96 GR,1.75,18.23,kg,2023-07-10
dia-es,limpieza_y_hogar,Colgador para wc pino SUPER PACO  BLISTER 96 GR,1.75,18.23,kg,2023-07-10
dia-es,limpieza_y_hogar,Gel desinfectante wc aroma fresco SANICENTRO   BOTELLA 1 LT,1.95,1.95,l,2023-07-10
dia-es,limpieza_y_hogar,Block wc pino poder activo BREF   BLISTER 2 UD,3.17,1.59,ud,2023-07-10
dia-es,limpieza_y_hogar,Gel limpiador wc 4 en 1 SANICENTRO   BOTELLA 1 LT,1.95,1.95,l,2023-07-10
dia-es,limpieza_y_hogar,Gel desatascador para tuberías SUPER PACO  BOTELLA 1 LT,1.99,1.99,l,2023-07-10
dia-es,limpieza_y_hogar,Gel limpiador wc 3 en 1 océano PATO   BOTELLA 750 ML,2.99,3.99,l,2023-07-10
dia-es,limpieza_y_hogar,Block wc azul poder activo BREF   BLISTER 1 UD,2.19,2.19,ud,2023-07-10
dia-es,limpieza_y_hogar,Block wc deluxe delicate magnolia BREF   BLISTER 1 UD,2.39,2.39,ud,2023-07-10
dia-es,limpieza_y_hogar,Discos activos aroma lima fresca PATO   CAJA 2 UD,5.29,2.65,ud,2023-07-10
dia-es,limpieza_y_hogar,Gel denso desatascador WC NET   BOTELLA 1 LT,6.99,6.99,l,2023-07-10
dia-es,limpieza_y_hogar,Desatascador turbo WC NET   BOTELLA 500 ML,5.99,11.98,l,2023-07-10
dia-es,limpieza_y_hogar,Limpiador de vitrocerámica SUPER PACO  SPRAY 500 ML,1.9,3.8,l,2023-07-10
dia-es,limpieza_y_hogar,Limpiador vitrocerámica crema VITROCLEN   BOTELLA 200 ML,3.99,19.95,l,2023-07-10
dia-es,limpieza_y_hogar,Limpiador de vitrocerámica en crema SUPER PACO  BOTELLA 500 ML,2.09,4.18,l,2023-07-10
dia-es,limpieza_y_hogar,Papel de aluminio SUPER PACO  CAJA 30 MT,2.89,0.1,m,2023-07-10
dia-es,limpieza_y_hogar,Papel de horno SUPER PACO  CAJA 20 UD,1.35,0.07,ud,2023-07-10
dia-es,limpieza_y_hogar,Film transparente FILMFIX   CAJA 80 MT,1.65,0.02,m,2023-07-10
dia-es,limpieza_y_hogar,Bolsas de congelación SUPER PACO  CAJA 30 UD,0.89,0.03,ud,2023-07-10
dia-es,limpieza_y_hogar,Bolsas de congelación zip 1 lt SUPER PACO  CAJA 20 UD,1.29,0.06,ud,2023-07-10
dia-es,limpieza_y_hogar,Film transparente 30 m ALBAL   CAJA 30 MT,2.65,0.09,m,2023-07-10
dia-es,limpieza_y_hogar,Papel de aluminio SUPER PACO  CAJA 50 MT,4.85,0.1,m,2023-07-10
dia-es,limpieza_y_hogar,Bolsas de congelación zipper 1 lt SUPER PACO  CAJA 15 UD,1.25,0.08,ud,2023-07-10
dia-es,limpieza_y_hogar,Bolsas de congelación zipper 3 lt SUPER PACO  CAJA 10 UD,1.25,0.13,ud,2023-07-10
dia-es,limpieza_y_hogar,Bolsas de papel para bocadillo SUPER PACO  CAJA 25 UD,2.09,0.08,ud,2023-07-10
dia-es,limpieza_y_hogar,Bolsa de rafia 4 asas DIA  1 UD,0.75,0.75,ud,2023-07-10
dia-es,limpieza_y_hogar,Insecticida moscas y mosquitos sin perfume XTERMIN   SPRAY 750 ML,2.45,3.27,l,2023-07-10
dia-es,limpieza_y_hogar,Insecticida eléctrico antimosquitos aparato + recambio XTERMIN   CAJA 1 UD,3.75,3.75,ud,2023-07-10
dia-es,limpieza_y_hogar,Insecticida eléctrico antimosquitos XTERMIN   CAJA 1 UD,2.29,2.29,ud,2023-07-10
dia-es,limpieza_y_hogar,Insecticida cucarachas y hormigas XTERMIN   SPRAY 400 ML,2.55,6.38,l,2023-07-10
dia-es,limpieza_y_hogar,Ambientador líquido concentrado blossom FORESAN   BOTELLA 125 ML,1.75,14.0,l,2023-07-10
dia-es,limpieza_y_hogar,Insecticida para el hogar XTERMIN   SPRAY 750 ML,2.45,3.27,l,2023-07-10
dia-es,limpieza_y_hogar,Pastillas antipolillas perfume lavanda DIA DIA  BOLSA 24 UD,1.45,0.06,ud,2023-07-10
dia-es,limpieza_y_hogar,Ambientador lavanda SPLASH   SPRAY 300 ML,1.3,4.33,l,2023-07-10
dia-es,limpieza_y_hogar,Ambientador brisa ASEVI   SPRAY 400 ML,2.75,6.88,l,2023-07-10
dia-es,limpieza_y_hogar,Pastillas antipolillas aroma ropa limpia DIA DIA  BOLSA 24 UD,1.45,0.06,ud,2023-07-10
dia-es,limpieza_y_hogar,Colgador antipolillas perfume lavanda DIA DIA  BOLSA 2 UD,1.49,0.75,ud,2023-07-10
dia-es,limpieza_y_hogar,Ambientador perlas lima TDOY AIR   BOTE 110 GR,1.85,16.82,kg,2023-07-10
dia-es,limpieza_y_hogar,Ambientador automático kiss SPLASH   SPRAY 250 ML,2.15,8.6,l,2023-07-10
dia-es,limpieza_y_hogar,Ambientador automático ropa limpia SPLASH   SPRAY 250 ML,2.15,8.6,l,2023-07-10
dia-es,limpieza_y_hogar,Ambientador perlas colonia TDOY AIR   BOTE 110 GR,1.85,16.82,kg,2023-07-10
dia-es,limpieza_y_hogar,Ambientador ropa limpia SPLASH   SPRAY 300 ML,1.3,4.33,l,2023-07-10
dia-es,limpieza_y_hogar,Insecticida hogar perfume rosas CASA JARDIN   SPRAY 600 ML,4.25,7.08,l,2023-07-10
dia-es,limpieza_y_hogar,Trampa para hormigas CASA JARDIN   CAJA 2 UD,2.99,1.5,ud,2023-07-10
dia-es,limpieza_y_hogar,Sobre perfumado flor de algodón LA CASA DE LOS AROMAS   SOBRE 2 UD,1.99,1.0,ud,2023-07-10
dia-es,limpieza_y_hogar,Ambientador mini spray aroma oceánico 2 unidades DIA DIA  BLISTER 24 ML,1.99,82.92,l,2023-07-10
dia-es,limpieza_y_hogar,Ambientador mini spray aroma explosión floral 2 unidades DIA DIA  BLISTER 24 ML,1.99,82.92,l,2023-07-10
dia-es,limpieza_y_hogar,Ambientador eliminador de olores frescor verde OUST   SPRAY 300 ML,3.99,13.3,l,2023-07-10
dia-es,limpieza_y_hogar,Insecticida concentrado cucarachicida CUCAL   SPRAY 400 ML,4.99,1.25,,2023-07-10
dia-es,limpieza_y_hogar,Bolsita perfumada aroma lavanda DIA DIA  BOLSA 3 UD,1.89,0.63,ud,2023-07-10
dia-es,limpieza_y_hogar,Ambientador eléctrico flor frescor AIR WICK   BLISTER 1 UD,4.99,4.99,ud,2023-07-10
dia-es,limpieza_y_hogar,Trampa para cucarachas CASA JARDIN   CAJA 6 UD,3.05,0.51,ud,2023-07-10
dia-es,limpieza_y_hogar,Ambientador coche tropical vibes AROMA   BOLSA 1 UD,1.39,1.39,ud,2023-07-10
dia-es,limpieza_y_hogar,Ambientador automático lavanda SPLASH   SPRAY 250 ML,2.15,8.6,l,2023-07-10
dia-es,limpieza_y_hogar,Ambientador automático floral SPLASH   SPRAY 250 ML,2.15,8.6,l,2023-07-10
dia-es,limpieza_y_hogar,Ambientador automático colonia SPLASH   SPRAY 250 ML,2.15,8.6,l,2023-07-10
dia-es,limpieza_y_hogar,Ambientador rosas SPLASH   SPRAY 300 ML,1.3,4.33,l,2023-07-10
dia-es,limpieza_y_hogar,Ambientador mikado mango MEYOMI  FRASCO 100 ML,3.45,3.45,,2023-07-10
dia-es,limpieza_y_hogar,Ambientador mikado fresa nata MEYOMI  FRASCO 100 ML,3.45,3.45,,2023-07-10
dia-es,limpieza_y_hogar,Aceite ambientador concentrado de eucalipto MIKAROMAS   FRASCO 30 ML,2.99,99.67,l,2023-07-10
dia-es,limpieza_y_hogar,Aceite ambientador concentrado de jazmín MIKAROMAS   FRASCO 30 ML,2.99,99.67,l,2023-07-10
dia-es,limpieza_y_hogar,Ambientador brisa de tahití ESENZA   SPRAY 300 ML,2.05,6.83,l,2023-07-10
dia-es,limpieza_y_hogar,Vela perfumada nata y fresa MEYOMI  CAJA 1 UD,1.95,1.95,ud,2023-07-10
dia-es,limpieza_y_hogar,Ambientador eléctrico 3volution aroma limpio AMBIPUR   BLISTER 21 ML,5.99,285.24,l,2023-07-10
dia-es,limpieza_y_hogar,Ambientador para coche AROMA   BLISTER 1 UD,2.15,2.15,ud,2023-07-10
dia-es,limpieza_y_hogar,Ambientador gel aroma flores blancas RELEVI   150 GR,1.09,7.27,kg,2023-07-10
dia-es,limpieza_y_hogar,Ambientador gel aroma RELEVI   150 GR,1.09,7.27,kg,2023-07-10
dia-es,limpieza_y_hogar,Incienso de lavanda LA CASA DE LOS AROMAS   CAJA 20 UD,1.15,0.06,ud,2023-07-10
dia-es,limpieza_y_hogar,Vela perfumada aire limpio MEYOMI  CAJA 1 UD,1.95,1.95,ud,2023-07-10
dia-es,limpieza_y_hogar,Vela perfumada frutos rojos MEYOMI  CAJA 1 UD,1.95,1.95,ud,2023-07-10
dia-es,limpieza_y_hogar,Vela perfumada vainilla MEYOMI  CAJA 1 UD,1.95,1.95,ud,2023-07-10
dia-es,limpieza_y_hogar,Ambientador flor garden   CAJA 85 ML,4.09,48.12,l,2023-07-10
dia-es,limpieza_y_hogar,Ambientador flor rose   CAJA 85 ML,4.09,48.12,l,2023-07-10
dia-es,limpieza_y_hogar,Desinfectante hogar y tejidos SANYTOL   SPRAY 300 ML,4.29,14.3,l,2023-07-10
dia-es,limpieza_y_hogar,Insecticida eléctrico líquido eco green CASA JARDIN   CAJA 33 ML,1.49,4.52,,2023-07-10
dia-es,limpieza_y_hogar,Ambientador mikado moras y frambuesas CRISTALINAS   CAJA 30 ML,3.1,103.33,l,2023-07-10
dia-es,limpieza_y_hogar,Ambientador baño nubes de algodón AMBIPUR   1 UD,4.29,4.29,ud,2023-07-10
dia-es,limpieza_y_hogar,Ambientador baño flores AMBIPUR   CAJA 1 UD,4.19,4.19,ud,2023-07-10
dia-es,limpieza_y_hogar,Ambientador aroma flores blancas MAYORDOMO   SPRAY 400 ML,2.35,5.88,l,2023-07-10
dia-es,limpieza_y_hogar,Ambientador automático riquezas de áfrica MAYORDOMO   SPRAY 250 ML,2.49,9.96,l,2023-07-10
dia-es,limpieza_y_hogar,Ambientador automático encantos de oriente MAYORDOMO   SPRAY 250 ML,2.49,9.96,l,2023-07-10
dia-es,limpieza_y_hogar,Ambientador eléctrico frutos rojos aparato + recambio SPLASH   CAJA 25 ML,3.19,127.6,l,2023-07-10
dia-es,limpieza_y_hogar,Ambientador eléctrico recambio flores blancas SPLASH   25 ML,1.95,78.0,l,2023-07-10
dia-es,limpieza_y_hogar,Ambientador eléctrico recambio ropa limpia SPLASH   25 ML,1.95,78.0,l,2023-07-10
dia-es,limpieza_y_hogar,Ambientador eléctrico recambio lavanda SPLASH   25 ML,1.95,78.0,l,2023-07-10
dia-es,limpieza_y_hogar,Ambientador eléctrico recambio frutos rojos SPLASH   25 ML,1.95,78.0,l,2023-07-10
dia-es,limpieza_y_hogar,Insecticida eléctrico antimosquitos RAID   1 UD,3.99,3.99,ud,2023-07-10
dia-es,limpieza_y_hogar,Ambientador absorbeolores aroma lavanda GLADE   BOTE 1 UD,2.99,2.99,ud,2023-07-10
dia-es,limpieza_y_hogar,Repelente antimosquitos BLOOM   SPRAY 1 UD,5.99,5.99,ud,2023-07-10
dia-es,limpieza_y_hogar,Ambientador antitabaco AMBIPUR   SPRAY 300 ML,4.79,15.97,l,2023-07-10
dia-es,limpieza_y_hogar,Ambientador eléctrico 3volution flores elegantes AMBIPUR   BLISTER 21 ML,5.99,0.29,ud,2023-07-10
dia-es,limpieza_y_hogar,Ambientador concentrado perfumado wc MAYORDOMO   BOTELLA 150 ML,1.69,11.27,l,2023-07-10
dia-es,limpieza_y_hogar,Ambientador eléctrico nenuco aparato + recambio AIR WICK   BLISTER 1 UD,5.99,5.99,ud,2023-07-10
dia-es,limpieza_y_hogar,Ambientador eléctrico aroma tatami japonés aparato + recambio AMBIPUR   BLISTER 1 UD,10.49,10.49,ud,2023-07-10
dia-es,limpieza_y_hogar,Ambientador colgador para coche colonia infantil DIA DIA  CAJA 1 UD,1.99,1.99,ud,2023-07-10
dia-es,limpieza_y_hogar,Ambientador colgador para coche frutos del bosque DIA DIA  CAJA 1 UD,1.99,1.99,ud,2023-07-10
dia-es,limpieza_y_hogar,Ambientador lavanda GLADE   BLISTER 2 UD,5.99,3.0,ud,2023-07-10
dia-es,limpieza_y_hogar,Ambientador automático fresh matic nenuco aparato + recambio AIR WICK   CAJA 1 UD,8.79,8.79,ud,2023-07-10
dia-es,limpieza_y_hogar,Insecticida multi-insectos RAID   CAJA 400 ML,6.29,15.73,l,2023-07-10
dia-es,limpieza_y_hogar,Ambientador freshmatic flores blancas AIR WICK   SPRAY 2 UD,8.99,4.5,ud,2023-07-10
dia-es,limpieza_y_hogar,Ambientador mikado frutos rojos AURA   CAJA 30 ML,2.59,86.33,l,2023-07-10
dia-es,limpieza_y_hogar,Ambientador freshmatic nenuco AIR WICK   SPRAY 2 UD,8.99,4.5,ud,2023-07-10
dia-es,limpieza_y_hogar,Ambientador eléctrico white bouquet AIR WICK   BLISTER 2 UD,8.99,4.5,ud,2023-07-10
dia-es,limpieza_y_hogar,Ambientador mini spray aroma frescor DIA DIA  BLISTER 24 ML,2.05,85.42,l,2023-07-10
dia-es,limpieza_y_hogar,Ambientador mini spray aroma zen DIA DIA  BLISTER 24 ML,2.05,85.42,l,2023-07-10
dia-es,limpieza_y_hogar,Ambientador multiusos forest fruits DIA DIA  BLISTER 14 GR,2.35,167.86,kg,2023-07-10
dia-es,limpieza_y_hogar,Ambientador eléctrico 3volution AMBIPUR   BLISTER 1 UD,4.29,4.29,ud,2023-07-10
dia-es,limpieza_y_hogar,Ambientador eléctrico nenuco AIR WICK   BLISTER 2 UD,8.99,4.5,ud,2023-07-10
dia-es,limpieza_y_hogar,Ambientador eléctrico 3volution tatami japonés AMBIPUR   BLISTER 1 UD,6.18,6.18,ud,2023-07-10
dia-es,limpieza_y_hogar,Ambientador automático lavanda y jazmín GLADE   CAJA 1 UD,6.39,6.39,ud,2023-07-10
dia-es,limpieza_y_hogar,Ambientador lavanda & jazmín aparato+recambio GLADE   BLISTER 1 UD,3.89,3.89,ud,2023-07-10
dia-es,limpieza_y_hogar,Ambientador lavanda & jazmín GLADE   BLISTER 1 UD,2.95,2.95,ud,2023-07-10
dia-es,limpieza_y_hogar,Antihumedad aroma lavanda aparato + recambio DIA DIA  CAJA 1 UD,3.45,3.45,ud,2023-07-10
dia-es,limpieza_y_hogar,Trampa detectora de polillas de los alimentos RAID   CAJA 3 UD,4.99,1.66,ud,2023-07-10
dia-es,limpieza_y_hogar,Pila alcalina aa CEGASA   BLISTER 4 UD,3.69,0.92,ud,2023-07-10
dia-es,limpieza_y_hogar,Pila alcalina aaa CEGASA   BLISTER 4 UD,3.69,0.92,ud,2023-07-10
dia-es,limpieza_y_hogar,Cañitas de papel de 4 colores BETIK   BOLSA 48 UD,1.49,0.03,ud,2023-07-10
dia-es,limpieza_y_hogar,Cerillas FLAM'UP   CAJA 3 UD,1.09,0.36,ud,2023-07-10
dia-es,limpieza_y_hogar,Platos de cartón redondo kraft de 22 cm BETIK   BOLSA 20 UD,1.99,0.1,ud,2023-07-10
dia-es,limpieza_y_hogar,Pila alcalina aa VARTA   BLISTER 4 UD,3.59,0.9,ud,2023-07-10
dia-es,limpieza_y_hogar,Guantes nitrilo desechables talla M BAYECO   CAJA 20 UD,2.5,0.13,ud,2023-07-10
dia-es,limpieza_y_hogar,Vasos de papel kraft de 24 cl BETIK   BOLSA 12 UD,1.99,0.17,ud,2023-07-10
dia-es,limpieza_y_hogar,Filtro 1x4 para café MELITTA   CAJA 40 UD,2.89,0.07,ud,2023-07-10
dia-es,limpieza_y_hogar,Vasos desechables compostable de 35 cl BETIK   BOLSA 15 UD,1.99,0.13,ud,2023-07-10
dia-es,limpieza_y_hogar,Guantes de látex desechables talla M BAYECO   CAJA 30 UD,2.99,0.1,ud,2023-07-10
dia-es,limpieza_y_hogar,Plumero SWIFFER   1 UD,5.99,5.99,ud,2023-07-10
dia-es,limpieza_y_hogar,Guantes nitrilo desechables talla S BAYECO   CAJA 20 UD,2.5,0.13,ud,2023-07-10
dia-es,limpieza_y_hogar,Briqueta de carbón LOS RIVERA   BOLSA 3 KG,3.69,1.23,kg,2023-07-10
dia-es,limpieza_y_hogar,Tenedor de maíz 175 mm BETIK   BOLSA 6 UD,0.6,0.1,ud,2023-07-10
dia-es,limpieza_y_hogar,Pila alcalina aaa VARTA   BLISTER 4 UD,3.59,0.9,ud,2023-07-10
dia-es,limpieza_y_hogar,Guantes reutilizables triple capa talla M SPONTEX   BOLSA 2 UD,3.29,1.65,ud,2023-07-10
dia-es,limpieza_y_hogar,Guantes desechables de látex multiusos talla S/M VILEDA   CAJA 10 UD,4.85,0.49,ud,2023-07-10
dia-es,limpieza_y_hogar,Cuchillo de maíz 180 mm BETIK   BOLSA 6 UD,0.6,0.1,ud,2023-07-10
dia-es,limpieza_y_hogar,Cucharilla de maíz 125 mm BETIK   BOLSA 6 UD,0.6,0.1,ud,2023-07-10
dia-es,limpieza_y_hogar,Guantes de látex desechables talla S BAYECO   CAJA 30 UD,2.99,0.1,ud,2023-07-10
dia-es,limpieza_y_hogar,Vasos desechables compostable de 1 lt BETIK   BOLSA 10 UD,3.35,0.34,ud,2023-07-10
dia-es,limpieza_y_hogar,Mascarilla quirúrgica infantil unisex PI MEDICAL   BOLSA 10 UD,1.19,0.12,ud,2023-07-10
dia-es,limpieza_y_hogar,Guantes desechables protección antivirus talla S SPONTEX   BOLSA 36 UD,5.19,0.14,ud,2023-07-10
dia-es,limpieza_y_hogar,Guantes desechables protección antivirus talla M SPONTEX   BOLSA 36 UD,5.29,0.15,ud,2023-07-10
dia-es,limpieza_y_hogar,Mascarillas higiénicas negra KLEENEX   BOLSA 5 UD,2.99,0.6,ud,2023-07-10
dia-es,limpieza_y_hogar,Recambio plumero SWIFFER   CAJA 6 UD,5.99,1.0,ud,2023-07-10
dia-es,limpieza_y_hogar,Carbón vegetal LOS RIVERA   BOLSA 3 KG,4.29,1.43,kg,2023-07-10
dia-es,limpieza_y_hogar,Guantes desechables talla M SPONTEX   BOLSA 20 UD,2.55,0.13,ud,2023-07-10
dia-es,limpieza_y_hogar,Guantes desechables talla S SPONTEX   BOLSA 20 UD,2.55,0.13,ud,2023-07-10
dia-es,limpieza_y_hogar,Guantes de látex natural talla M SPONTEX   CAJA 50 UD,6.79,0.14,ud,2023-07-10
dia-es,limpieza_y_hogar,Pila botón cr2032 VARTA   BLISTER 2 UD,3.59,1.8,ud,2023-07-10
dia-es,limpieza_y_hogar,Mopa microfibra set SPONTEX   1 UD,12.29,12.29,ud,2023-07-10
dia-es,limpieza_y_hogar,Guantes reutilizables segunda piel talla M SPONTEX   BOLSA 2 UD,4.55,2.28,ud,2023-07-10
dia-es,limpieza_y_hogar,Pila alcalina max power aa VARTA   BLISTER 4 UD,6.15,1.54,ud,2023-07-10
dia-es,limpieza_y_hogar,Pila alcalina power aa VARTA   BLISTER 4 UD,5.49,1.37,ud,2023-07-10
dia-es,limpieza_y_hogar,Pila alcalina power aaa VARTA   BLISTER 4 UD,5.49,1.37,ud,2023-07-10
dia-es,limpieza_y_hogar,Guantes desechables de látex multiusos talla M/L VILEDA   CAJA 10 UD,4.45,0.45,ud,2023-07-10
